sku,name,desc,price,promo_price,type
APP1709,Apple Watch Series 2 38mm Stainless Steel Case and Strap White Sport,Apple Watch 38 mm with GPS dual-core processor and retina display submersible 50mts,669.0,669.0,24885185
APP1726,Apple Watch Series 2 42mm Stainless Steel Case and Strap White Sport,Apple Watch 42 mm dual core processor with GPS retina display and submersible 50mts,719.0,719.0,24895185
APP1788,Apple Correa Rosa 38mm Sport Arena,Durable and flexible strap sports with clip closure for Apple Watch 38mm,59.0,59.0,2449
APP1733,Apple Watch Series 2 42mm Case Stainless Steel Bracelet Black Space and Loop Milanese same tone,Apple Watch 42 mm dual core processor with GPS retina display and submersible 50mts,869.0,869.0,24895185
APP1790,Apple Correa 38mm Sports Blue Ocean,Durable and flexible strap sports with clip closure for Apple Watch 38mm,59.0,59.0,2449
APP1794,Apple Correa 42mm Sports Blue Ocean,durable and flexible sports strap with clip closure for Apple Watch 42 mm,59.0,59.0,2449
HAR0008-A,Open - Harman Kardon Esquire Mini Portable Speaker Black,Bluetooth wireless speaker refitted with battery for iPhone iPad and iPod.,149.99,119.98,5398
APP1798,Braided Strap 38mm Nailon Apple Yellow / Light Gray,Braided nylon strap with four layers of tissue for Apple Watch 38 mm,59.0,55.99,2449
APP1807,Apple Correa Nailon 38mm Braid Navy / Blue Lagoon,Braided nylon strap with four layers of tissue for Apple Watch 38 mm,59.0,55.0,2449
APP1800,Apple Strap Orange 42mm Braiding Nailon Space / Anthracite,Braided nylon strap with four layers of tissue for Apple Watch 42 mm,59.0,59.0,2449
GRT0446,Griffin Survivor iPhone Case Journey 8 Plus / 7 Plus / 6s Plus / 6 Plus Black / Gray,rugged case with shock dispersion system for iPhone 8 Plus / 7 Plus / 6s Plus / 6 Plus,29.99,19.99,11865403
MUJ0022,Mujjo Leather Wallet Leather Case iPhone 8 Plus / 7 Plus Champagne,ultrathin cover with card case and material vegetable tanned leather for iPhone 7 Plus,49.9,44.99,11865403
LOG0211,Logitech Ultimate Ears UE Megaboom Wireless Speaker Purplay,Logitech Portable Bluetooth Speaker for iPhone iPad and iPod.,309.0,184.99,5398
MAC0118-A,(Open) Macally Mini DisplayPort to DVI / HDMI / VGA 4K,Adapter Mini Display Port 3 in 1 1080p and 4K for Mac.,39.95,24.31,1298
BEL0285,Belkin iPhone Screen Protector InvisiGlass 8/7,Screensaver 2mm thick flexible glass absorbs impact iPhone,19.99,14.99,13555403
ZAG0029,Zagg Invisible Shield Glass Screen Protector iPhone 8/7 Plus,Protector Ultra soft edges beveled tempered glass for iPhone 8 Plus or 7-Plus,19.99,17.99,13555403
BEL0288,Belkin iPhone Screen Protector InvisiGlass 8 Plus / 7 Plus,Screensaver 20mm thick flexible glass absorbs impact iPhone 8 Plus / Plus 7,19.99,14.99,13555403
BEL0286,Belkin ScreenForce Tempered Glass Protector iPhone 8/7,Screensaver tempered glass 0.33mm thick hardness rating 9H iPhone,19.99,16.99,13555403
BEL0289,Tempered Glass Protector Belkin iPhone ScreenForce 8 Plus / 7 Plus,Screensaver tempered glass 0.33mm thick hardness rating 9H iPhone 8 Plus or 7 Plus,19.99,16.99,13555403
EXT0007,Extreme Fliers Micro Drone 3.0 Combo Pack,Micro Drone with 720p HD wireless camera remote control and rechargeable virtual reality glasses and app for iPhone,199.99,199.99,11905404
GRT0448,Griffin Survivor iPhone Case Journey 8 Plus / 7 Plus / 6s Plus / 6 Plus Black / Blue,rugged case with shock dispersion system for iPhone 8 Plus / 7 Plus / 6s Plus / 6 Plus,29.99,12.99,11865403
GRT0447,Griffin Survivor iPhone Case Journey 8 Plus / 7 Plus / 6s Plus / 6 Plus Gray / Pink,rugged case with shock dispersion system for iPhone July 8 6s and 6 Plus versions,29.99,15.99,11865403
GRT0449,Griffin Survivor iPhone Case Journey 8 Plus / 7 Plus / 6s Plus / 6 Plus Black / White,rugged case with shock dispersion system for iPhone 8 Plus / 7 Plus / 6s Plus / 6 Plus,29.99,11.99,11865403
GRT0345,Griffin Reveal Case Black iPhone 6 Plus,resistant pouch with transparent backside for iPhone 6 Plus,19.99,14.99,11865403
CRU0055,Crucial MX300 2TB SSD 7mm,2TB SSD Hard Drive SATA 3.0 (6Gb / s) for Mac and PC,580.55,479.99,12215397
GRT0454,Griffin Survivor Black Power Bank 10050mAh,Portable External Battery 10050 mAh durable and waterproof design for iPhone iPod and iPad,69.99,49.99,1515
SAN0161,SanDisk Connect Wireless Flash Drive 200GB Wireless,200GB pendrive with WIFI and USB 2.0 connection for iPhone iPad and Mac,109.99,93.0,42945397
MOS0221,Moshi USB 3.0 to Gigabit Ethernet Adapter,USB 3.0 Gigabit Ethernet adapter for Mac and PC,40.0,30.99,12585395
IKM0059,Ik Multimedia Monitor iLoud Micro Bluetooth Speaker Black,Professional monitoring speakers with high-quality 56-bit DSP Class D bi-amplification (50W RMS) for iPhone iPad and Mac,365.99,285.0,5398
PHI0075,Philips Hue White Ambiance Pack 2 bulbs E27 Starter Kit + Bridge + Dimmer,Philips Lighting Kit with Dimmer and switch included,139.95,109.99,11905404
OWC0189,SSD upgrade kit OWC Aura Pro 6G 240GB MacBook Pro Retina and MacBook Air 2013 to 2015,240GB SSD hard drive for MacBook Pro Retina Late 2015 and Mid 2013 Mid 2013 MacBook Air tools Early 2015,423.99,353.58,12215397
OWC0190,25 or OWC Dual Dock Station USB 3.1 HDD 35,Disk dock 25-inch and 35-inch USB 3.1 cable incluódo Mac and PC,96.99,76.99,12995397
OWC0191,OWC Envoy Pro USB 3.0 Case for MacBook Pro Retina 2012 - iMac Late 2012,Box Portable External USB 3.0 SSD for MacBook Pro Retina 2012 / iMac 2012,118.99,69.99,11935397
OWC0192, OWC SSD Disk 240GB 6G Neptune 7mm SATA 3,internal disk reading speed 6Gb / s to 511MB / s for Mac,120.99,97.99,12215397
OWC0193,OWC SSD Disk 480GB 6G Neptune 7mm SATA 3,internal disk reading speed 6Gb / s to 511MB / s for Mac,205.99,166.58,12215397
DLL0047,Dell E-series E2417H 24 FHD IPS DP VGA,Monitor 24 inch FHD with high vision support with adjustable inclination for Mac and PC,196.6,165.99,1296
PHI0077,Philips Hue Single Bulb E27 White Ambiance,Individual E27 different color temperatures Philips HUE,34.95,30.99,11905404
PHI0076,Philips Hue Motion Motion Sensor,System motion sensor for Philips Hue,39.95,34.99,11905404
OWC0201,OWC USB-C Dock USB 3.1 / HDMI / Audio / GigaEthernet Rose Gold,Dock USB-C multiple connections and SD reader Macbook.,217.99,149.99,12995397
OWC0194,OWC Mercury Extreme Pro 960GB SSD 7mm SATA Disk 3,SSD 960GB SATA hard drive for Mac and PC III,544.99,436.58,12215397
OWC0195,OWC ThunderBay IV mini Thunderbolt 2 RAID5,External storage box mini Thunderbolt April 2 edition bays RAID 5 for Mac and PC,574.99,394.99,11935397
OWC0196,Mac OWC Memory 16GB 1333MHZ DDR3 DIMM,16GB RAM for Mac Pro 2010/2012,119.99,119.99,1364
DLL0014-A,"Open - Dell S2715H Monitor 27 ""FHD IPS HDMI VGA",Monitor 27-inch widescreen HD for Mac and PC,347.27,262.57,1298
PAC1531,Pack Elgato Eve Weather Sensor + Room Interior / Exterior,Two temperature and humidity sensors air quality for the exterior and interior supports iPhone and IPAD,129.94,113.99,11905404
APP1922,AirPods Apple Bluetooth Headset for iPhone iPad iPod and Apple Watch,Apple AirPods wireless headsets and cargo transport box,179.0,161.0,5384
TRK0003-A,Open - Bravo Locator Silver Trackr,Bluetooth locator objects APP for iPhone,29.99,20.52,1298
OWC0177-A,Open - OWC Aura Pro 6G 480GB SSD for MacBook Air and MacBook Pro Retina,Hard Drive 480GB SSD MacBook Air (2013-2015) and MacBook Pro Retina (2013-2014-2015) + tools + external box,568.99,494.58,1298
LGE0045,LG 23MP48HQ-P 23 FHD IPS HDMI Monitor,Monitor with HDMI panel 23 iPS connection: accurate colors elegant and refined design for Mac and PC,149.0,129.0,1296
BEA0059,Beats by Dr. Dre Beats Headphones Black X,Bluetooth headsets 8 hour recharge Fast Fuel and RemoteTalk for iPhone iPad and iPod,149.95,132.99,5384
BEA0060,Beats by Dr. Dre Beats Headphones White X,Bluetooth headset with charging Fast Fuel and RemoteTalk for iPhone iPad and iPod,149.95,132.99,5384
BEA0055,EP Beats On-Ear Headphones Black,Headphones type hull rigid shell and RemoteTalk controls for iPhone iPod and iPad,99.95,89.99,5384
BEA0056,Beats On-Ear Headphones EP White,Headphones type hull rigid shell and RemoteTalk controls for iPhone iPod and iPad,99.95,89.99,5384
BEA0058,Beats On-Ear Headphones EP Blue,Headphones type hull rigid shell and RemoteTalk controls for iPhone iPod and iPad,99.95,89.99,5384
BEA0061,Solo3 Beats Headphones Wireless On-Ear Black Satin,Bluetooth helmets integrated chip W1 40h battery life for iPhone and iPad Apple Watch Mac,299.95,259.0,5384
BEA0062,Solo3 Beats Headphones Wireless On-Ear White Satin,Bluetooth helmets (wireless) integrated chip W1 40h battery life for Apple iPhone Watch iPad and Mac,299.95,259.99,5384
BEA0063,Solo3 Beats Headphones Wireless On-Ear Silver,Bluetooth helmets integrated chip W1 40h battery life for iPhone and iPad Apple Watch Mac,299.95,259.99,5384
BEA0064,Solo3 Beats Headphones Wireless On-Ear Gold,Bluetooth helmets integrated chip W1 40h battery life for iPhone and iPad Apple Watch Mac,299.95,259.99,5384
BEA0065,Solo3 Beats Headphones Wireless On-Ear Rose Gold,Bluetooth helmets integrated chip W1 40h battery life for iPhone and iPad Apple Watch Mac,299.95,259.99,5384
APP0989-A,"Open - Apple MacBook Pro Retina 15 ""i7 22 GHz | RAM 16GB | 256GB Flash",MacBook Retina 15 inch screen reconditioned i7 22GHz RAM 16GB 256GB,2249.0,1956.05,1298
BEA0053,Powerbeats3 Beats Wireless Headphones Black,AcÌ¼stico headphones and waterproof design for iPhone iPad and iPod,199.95,179.99,5384
BEA0054,Powerbeats3 Beats Wireless Headphones White,AcÌ¼stico headphones and waterproof design for iPhone iPad and iPod,199.95,179.99,5384
BEA0066,Powerbeats3 Beats Headphones Wireless Flash Blue,AcÌ¼stico headphones and waterproof design for iPhone iPad and iPod,199.95,170.99,5384
BEA0067,Powerbeats3 Beats Wireless Headphones Red Siren,AcÌ¼stico headphones and waterproof design for iPhone iPad and iPod,199.95,179.99,5384
BEA0068,Beats Wireless Headphones Shock Yellow Powerbeats3,AcÌ¼stico headphones and waterproof design for iPhone iPad and iPod,199.95,179.99,5384
BOS0043,Bose QuietComfort 35 Headphones MFi Black,Bluetooth headset made of nylon glass and up to 20 hours of music with unique sound for iPhone iPad and iPod,379.0,279.0,5384
BOS0044,Bose Headphones Quietcomfort 35 MFi Plata,Bluetooth headset made of nylon glass and up to 20 hours of music with unique sound and iPod iPhoneiPad,379.0,279.0,5384
BOS0046,Bose Headphones SoundTrue IFM Ultra Ice Gray,Compact and waterproof headphones and covered StayHear Ultra T-shaped design for iPhone iPad and iPod,129.0,112.99,5384
BNQ0032-A,"Open - LED Monitor Benq 238 BL2420PT """,238 LED monitor flicker-free inch to reduce eyestrain,249.0,231.1,1298
LAC0201,Rugged Hard Disk 1TB USB-C USB 3.1,Hard disk external hard with anti-shock protection and USB-C connection for Mac and PC,119.99,92.0,11935397
LAC0202,Lacie Rugged Hard Drive 2TB USB-C,Hard disk external hard with anti-shock protection and USB-C connection for Mac and PC,154.99,114.99,11935397
LAC0203,Lacie Rugged Hard Drive 4TB USB-C,Hard disk external hard with anti-shock protection and USB-C connection for Mac and PC,219.99,170.99,11935397
RAI0017,"Rain Design Mbase 215 iMac Support """,Minimalist lifting support drawer 215 inch iMac,72.99,64.99,8696
BOS0047,Bose Headphones Black Quietcomfort 20 IFM,In-Ear Headphones canceling outside noise plugs parts and call control for iPhone iPad and iPod,279.0,244.99,5384
RAI0013,Silver Rain Design mStand360 Support,Swivel stand compatible with all MacBook aluminum,72.99,56.99,8696
BOS0049,SoundSport Bose Headphones Black Wireless,In-Ear Headphone wireless waterproof and built-in microphone and iPhone iPad iPod,179.0,155.99,5384
BOS0050,Bose Wireless Headphones Aqua SoundSport,In-Ear Earphones waterproof and wireless microphone for iPhone iPad and iPod,179.0,155.99,5384
BEA0071,Solo3 Beats Wireless On-Ear Headphones Black,Bluetooth helmets (wireless) integrated chip W1 40h battery life for Apple iPhone Watch iPad and Mac,299.95,259.99,5384
PAR0066,Parrot MAMBO Minidrone + 2 Accessories,"Mini drone with accessories included: pitcher marbles and tweezers 8Å ""autonomously for iPhone and iPad",119.0,98.99,11905404
RAI0019,Rain Design mStand Support Gold,Aluminum support compatible with all MacBook,59.99,44.99,8696
PAR0068,Mando Parrot FLYPAD,Mando compatible with minidrones includes support for iPhone,39.0,36.99,11905404
PAR0069,Parrot FPV Glasses + Command Pack 2 Skycontroller,Pack Control + glasses or Cockpitglasses for Parrot Parrot Bebop Disco 2,349.0,336.99,11905404
LAC0208,LaCie d2 Hard Drive 8TB Thunderbolt 2 USB 3.0,8TB external hard drive designed to work 24x7 Thunderbolt 2 and 5 years warranty for Mac and PC,489.0,399.99,11935397
LAC0211,16TB LaCie 2big Thunderbolt 2,RAID 16TB double disc box designed to work 24x7 Thunderbolt 2 and 5 years warranty for Mac and PC,989.0,794.99,11935397
PAR0071,Parrot Bebop 2 White + Command FLYPAD and FPV Glasses,cuadricóptero wireless remote control with 25 minutes of autonomous control FLYPAD and FPV Glasses for iPhone iPad and iPod. Parrot,699.0,569.0,11905404
OWC0172-A,Open - OWC USB-C Dock USB3 / HDMI / Audio / GigaEthernet Plata,Dock USB-C multiple connections and SD reader Macbook.,217.99,153.72,1298
TUC0285-A,Open - Tucano DUEINUNO iPhone Case 2 in 1 Gold 7,Case 2 in 1 with removable rear cover and anti-radiation system for iPhone 7,26.9,16.29,1298
SPE0181-A,Open - Speck iPhone Case Presidio 7 Clear Plus,cover slip with slim design and touch buttons for iPhone 7 Plus,29.95,17.99,1298
WAC0048-A,Open - Wacom Bamboo Pen (pen for CTH-470K Replacement),PDA replacement pen CTL-470K.,34.9,31.99,1298
APP0405-A,Open - Apple Keyboard Keypad International English Mac,USB ultrathin keyboard Apple Mac English.,59.0,49.48,1298
ZAG0022-A,"Open - Zagg keyboard Messenger Case iPad Air / Air2 / iPad Pro 97 ""Black",skinny sleeve with bluetooth keyboard and adjustable design for iPad Air / Air 2 / iPad Pro 97-inch,69.99,36.29,1298
WDT0347,WD Blue 250GB SATA 3 SSD Disk 7mm,SSD 250GB SATA Hard Disk 3.0 (6Gb / s) for Mac and PC,99.0,85.99,12215397
WDT0348,WD Blue 500GB SATA 3 SSD Disk 7mm,SSD 500GB SATA Hard Disk 3.0 (6Gb / s) for Mac and PC,169.0,149.99,12215397
WDT0349,WD 1TB SATA SSD Blue Disco 3 7mm,SSD Hard Drive 1TB SATA 3.0 (6Gb / s) for Mac and PC,339.0,261.99,12215397
LGE0046,"24UD58-B LG Monitor 238 ""4K UHD",238 inch monitor with 2 HDMI ports and a Display Port: sleek and slim design with support for Mac and PC ArcLine,349.0,285.0,1296
IKM0062,IK Multimedia iRig Guitar Interface 96kHz HD 2,Guitar interface for recording high quality audio 24bit / 96kHz compatible headphone amplifier port and Mac iPad iPhone (MFi),121.99,86.99,11905404
SNA0066,Heritage Sena Correa Apple Watch 42mm Denim,Original leather strap with visible seams for Apple Watch 42mm,69.95,49.0,2449
SNA0067,Sena Correa Heritage Cognac 42mm Apple Watch,Original leather strap with visible seams for Apple Watch 42mm,69.95,49.99,2449
OLL0023,Active olloclip iPhone Lens 8/7 and 8/7 Plus Black,Set of two lenses: wide angle and telephoto 2X for iPhone 8/7 and 8/7 Plus iPhone,149.99,129.99,11905404
OWC0168-A,"Open - expansion Kit OWC Aura SSD 480GB 6G MacBook Air 11 ""and 13"" 2012",480GB SSD expansion for MacBook Air 11-inch and 13-inch Mid 2012 Kit tools,362.99,282.74,1298
OLL0024,Core olloclip iPhone Lens 8/7 and 8/7 Plus Black,Set of three lenses: ultra-wide fisheye and macro and 15X for iPhone 8/7 iPhone 8/7 Plus,119.99,99.99,11905404
OLL0025,Olloclip Macro Lens Pro iPhone 6s 8 July 6 and July 8 Black Plus 6 S -6-,Lens with three focal lengths 7X 21X and 14X camera for the iPhone 6S August 7 and 6 (Plus also),99.99,89.99,11905404
DRO0026,5C Drobo 5-bay DAS RAID USB-C USB 3.0,RAID 5 bays and USB 3.0 Type-C for Mac and PC,429.0,368.99,11935397
IFX0152,iFixit Battery full Battery Kit iPhone 6s change,Battery replacement kit with tools for iPhone 6s,44.95,44.95,12645406
IFX0153,iFixit iPhone 6s piece Internal Battery,Replacement battery compatible with iPhone 6s,39.95,24.99,21485407
IFX0154,iFixit Battery Battery Kit complete change iPhone 6s Plus,Battery replacement kit with tools for iPhone 6s Plus,44.95,44.95,12645406
IFX0155,Part iFixit iPhone 6s Plus Internal Battery,Replacement battery compatible with iPhone 6s Plus,39.95,29.99,21485407
IFX0156,"Battery iFixit MacBook Air 13 ""Early 2015 Mid 2012",Replacement Battery for MacBook Air 13-inch Mid 2012 to Early 2015,109.99,99.99,13005399
PEB0001-A,Open - Pebble Smartwatch Original Black,Bluetooth watch intelligent LED backlit compatible with iPhone,129.99,34.98,1298
SEA0093-A,Open - Seagate 2TB hard disk FireCuda Hibrido SSHD 35 Sata 3,HDD SSHD 2TB SATA interface 6 GB / s and 7200 rpm rotation speed for Mac and PC,139.99,103.41,1298
LGE0026-A,"Open - 31MU97Z-B LG Monitor 31 ""4K pivotable Thunderbolt 2",31-inch 4K monitor screen split and multiple ports.,1099.0,909.99,1298
APP1744,Watch Apple Nike + 38mm Aluminum Case and Space Gray Nike Sport Strap Black / Gray Bluish,Apple Watch 38 mm GPS processor with dual core Submersible 50mts strap exclusive Nike +,439.0,415.99,24895185
APP1745,Watch Apple Nike + 42mm Aluminum Case and Space Gray Nike Sport Strap Black / Gray Bluish,Apple Watch 42 mm GPS processor with dual core Submersible 50mts strap exclusive Nike +,469.0,469.0,24895185
APP1746,Watch Apple Nike + Series 2 38mm Aluminum Case and Space Gray Nike Sport Strap Black / Volt,Apple Watch 38 mm GPS processor with dual core Submersible 50mts strap exclusive Nike +,439.0,359.0,24895185
APP1747,Watch Apple Nike + 42mm Aluminum Case and Space Gray Nike Sport Strap Black / Volt,Apple Watch 42 mm GPS processor with dual core Submersible 50mts strap exclusive Nike +,469.0,455.0,24895185
OWC0164,Aura OWC 960GB 6G SSD Kit MacBook Air 2012,Hard Drive Kit 960GB SSD for MacBook Air 2012 + tools + external box.,640.99,486.58,12215397
ADN0044,Adonit Jot Dash 2 Pointer Black,Egonómico slightly pointer design and up to 14 hours battery for iPad iPhone or iPod,49.99,46.99,1229
ADN0045,Adonit Jot Dash 2 Pointer Silver,Egonómico slightly pointer design and up to 14 hours battery for iPad iPhone or iPod,49.99,46.99,1229
ADN0046,Snap Pointer Black Bluetooth Adonith,Egonómico pointer lightweight design magnet for iPhone,34.99,29.99,1229
ADN0047,Adonith Bluetooth Snap Rose Gold Pointer,Bluetooth egonómico pointer with lightweight design and magnet for iPhone,34.99,29.99,1229
ADN0048,Adonith Snap Pointer Bluetooth White,Egonómico pointer lightweight design and magnet for iPhone,34.99,29.99,1229
OTT0159,Otterbox Clearly Protected Case iPhone 8/7 Transparent gel,TPU transparent cover flexible lightweight one piece iPhone 8 or 7,19.99,12.99,11865403
GTE0056,G-Technology G-Drive ev RaW 2TB USB 3.0 Hard Drive,External Hard Drive USB 3.0 2TB capacity includes bumper bumper for Mac and PC,142.99,125.99,11935397
SAN0169,Sandisk Extreme Memory Card 128GB v30 microSDXC UHS-I 90MB / s-60MB / s,Memory card reading speed 90MB / s and speed of video: U3 C10 and V30,79.99,69.28,57445397
APP1812,"Apple MacBook Pro 13 ""with Touch Bar GHz Core i5 29 | 8GB RAM | 256GB PCIe SSD Gray Space",New MacBook Pro 13-inch Core i5 Touch Bar to 29GHz with 8GB of RAM and 256GB SSD PCIe (MLH12Y / A),1999.0,1785.59,2158
APP1838,"Apple MacBook Pro 13 ""Core i5 with Touch Bar 31GHz | 8GB RAM | 256GB PCIe SSD Gray Space",New MacBook Pro 13-inch Core i5 Touch Bar to 31GHz with 8GB of RAM and 256GB SSD PCIe (MLH12Y / A),2119.0,1755.59,2158
APP1839,"Apple MacBook Pro 13 ""Core i5 with Touch Bar 31GHz | RAM 16GB | 256GB PCIe SSD Gray Space",New MacBook Pro 13-inch Core i5 Touch Bar to 31GHz with 16GB of RAM and 256GB SSD PCIe (MLH12Y / A),2359.0,2247.58,2158
APP1840,"Apple MacBook Pro 13 ""with Touch Bar 33GHz Core i7 | 8GB RAM | 256GB PCIe SSD Gray Space",New MacBook Pro 13 inch Touch Bar 33 GHz Core i7 with 8GB of RAM and 256GB SSD PCIe (MLH12Y / A),2359.0,2247.58,2158
APP1841,"Apple MacBook Pro 13 ""with Touch Bar 33GHz Core i7 | RAM 16GB | 256GB PCIe SSD Gray Space",New MacBook Pro 13 inch Touch Bar 33 GHz Core i7 with 16GB of RAM and 256GB SSD PCIe (MLH12Y / A),2599.0,2305.59,2158
APP1842,"Apple MacBook Pro 13 ""with Touch Bar GHz Core i5 29 | RAM 16GB | 256GB PCIe SSD Gray Space",New MacBook Pro 13-inch Core i5 Touch Bar 29 GHz with 16GB of RAM and 256GB SSD PCIe (MLH12Y / A),2239.0,2065.59,2158
APP1846,"Apple MacBook Pro 13 ""with Touch Bar 33GHz Core i7 | RAM 16GB | 256GB PCIe SSD Plata",New MacBook Pro 13 inch Touch Bar 33 GHz Core i7 with 16GB of RAM and 256GB SSD PCIe (MLH12Y / A),2599.0,2475.58,2158
APP1847,"Apple MacBook Pro 13 ""with Touch Bar GHz Core i5 29 | RAM 16GB | 256GB PCIe SSD Plata",New MacBook Pro 13-inch Core i5 Touch Bar 29 GHz with 16GB of RAM and 256GB SSD PCIe (MLH12Y / A),2239.0,2065.59,2158
APP1813,"Apple MacBook Pro 13 ""with Touch Bar GHz Core i5 29 | 8GB RAM | 256GB PCIe SSD Plata",New MacBook Pro 13-inch Core i5 Touch Bar to 29GHz with 8GB of RAM and 256GB SSD PCIe (MLVP2Y / A),1999.0,1795.58,2158
APP1814,"Apple MacBook Pro 13 ""with Touch Bar GHz Core i5 29 | 8GB RAM | 512GB PCIe SSD Gray Space",New MacBook Pro 13-inch Core i5 Touch Bar to 29GHz with 8GB of RAM and 512GB of SSD PCIe (MNQF2Y / A),2199.0,2036.58,2158
APP1849,"Apple MacBook Pro 13 ""Core i5 with Touch Bar 31GHz | RAM 16GB | 512GB PCIe SSD Gray Space",New MacBook Pro 13-inch Core i5 Touch Bar to 31GHz with 16GB of RAM and 512GB of SSD PCIe (MNQF2Y / A),2559.0,2437.58,2158
APP1853,"Apple MacBook Pro 13 ""with Touch Bar 33GHz Core i7 | RAM 16GB | 512GB PCIe SSD Gray Space",New MacBook Pro 13 inch Touch Bar 33 GHz Core i7 with 16GB of RAM and 512GB of SSD PCIe (MNQF2Y / A),2799.0,2665.58,2158
APP1854,"Apple MacBook Pro 13 ""with Touch Bar 33GHz Core i7 | 16GB RAM | 1TB PCIe SSD Gray Space",New MacBook Pro 13 inch Touch Bar 33 GHz Core i7 with 16GB of RAM and 1TB PCIe SSD (MNQF2Y / A),3279.0,2965.6,2158
APP1856,"Apple MacBook Pro 13 ""with Touch Bar GHz Core i5 29 | RAM 16GB | 512GB PCIe SSD Gray Space",New MacBook Pro 13-inch Core i5 Touch Bar 29 GHz with 16GB of RAM and 512GB of SSD PCIe (MNQF2Y / A),2439.0,2323.58,2158
APP1860,"Apple MacBook Pro 13 ""Core i5 with Touch Bar 31GHz | RAM 16GB | 512GB PCIe SSD Plata",New MacBook Pro 13-inch Core i5 Touch Bar 31 GHz with 16GB of RAM and 512GB of SSD PCIe (MNQG2Y / A),2559.0,2355.59,2158
APP1864,"Apple MacBook Pro 13 ""with Touch Bar 33GHz Core i7 | RAM 16GB | 512GB PCIe SSD Plata",New MacBook Pro 13 inch Touch Bar 33 GHz Core i7 with 16GB of RAM and 512GB of SSD PCIe (MNQG2Y / A),2799.0,2665.58,2158
APP1865,"Apple MacBook Pro 13 ""with Touch Bar 33GHz Core i7 | 16GB RAM | 1TB PCIe SSD Plata",New MacBook Pro 13 inch Touch Bar 33 GHz Core i7 with 16GB of RAM and 1TB PCIe SSD (MNQG2Y / A),3279.0,2905.59,2158
APP1867,"Apple MacBook Pro 13 ""with Touch Bar GHz Core i5 29 | RAM 16GB | 512GB PCIe SSD Plata",New MacBook Pro 13-inch Core i5 Touch Bar 29 GHz with 16GB of RAM and 512GB of SSD PCIe (MNQG2Y / A),2439.0,2245.59,2158
APP1852,"Apple MacBook Pro 13 ""with Touch Bar 33GHz Core i7 | 8GB RAM | 512GB PCIe SSD Gray Space",New MacBook Pro 13 inch Touch Bar 33 GHz Core i7 with 8GB of RAM and 512GB of SSD PCIe (MNQF2Y / A),2559.0,2437.58,2158
APP1816,"Apple MacBook Pro 15 ""Core i7 Touch Bar 26GHz | RAM 16GB | 256GB PCIe SSD | 450 2GB Radeon Pro Space Gray",New MacBook Pro 15-inch Touch Bar to 26GHz Core i7 with 16GB of RAM and 256GB SSD PCIe (MLH32Y / A),2699.0,2385.59,2158
APP1870,"Apple MacBook Pro 15 ""Core i7 Touch Bar 29GHz | RAM 16GB | 256GB PCIe SSD | 450 2GB Radeon Pro Space Gray",New MacBook Pro 15-inch Core i7 Touch Bar 29Ghz with 16GB of RAM and 256GB SSD PCIe (MLH32Y / A),3079.0,2505.59,2158
APP1874,"Apple MacBook Pro 15 ""Core i7 Touch Bar 29GHz | RAM 16GB | 256GB PCIe SSD | 460 4GB Radeon Pro Space Gray",New MacBook Pro 15-inch Core i7 Touch Bar 29Ghz with 16GB of RAM and 256GB SSD PCIe (MLH32Y / A),3319.0,3159.58,2158
APP1875,"Apple MacBook Pro 15 ""Core i7 Touch Bar 29GHz | RAM 16GB | 512GB PCIe SSD | 460 4GB Radeon Pro Space Gray",New MacBook Pro 15-inch Core i7 Touch Bar 29Ghz with 16GB of RAM and 512GB of SSD PCIe (MLH32Y / A),3559.0,3387.58,2158
APP1876,"Apple MacBook Pro 15 ""Core i7 Touch Bar 29GHz | 16GB RAM | 1TB PCIe SSD | 460 4GB Radeon Pro Space Gray",New MacBook Pro 15-inch Core i7 Touch Bar 29Ghz with 16GB of RAM and 1TB PCIe SSD (MLH32Y / A),4039.0,3843.58,2158
APP1877,"Apple MacBook Pro 15 ""Core i7 Touch Bar 29GHz | 16GB RAM | 2TB PCIe SSD | 460 4GB Radeon Pro Space Gray",New MacBook Pro 15-inch Core i7 Touch Bar 29Ghz with 16GB of RAM and 2TB of SSD PCIe (MLH32Y / A),4999.0,4755.59,2158
APP1878,"Apple MacBook Pro 15 ""Core i7 Touch Bar 26GHz | RAM 16GB | 512GB PCIe SSD | 450 2GB Radeon Pro Space Gray",New MacBook Pro 15-inch Touch Bar to 26GHz Core i7 with 16GB of RAM and 512GB of SSD PCIe (MLH32Y / A),2939.0,2655.59,2158
APP1879,"Apple MacBook Pro 15 ""Core i7 Touch Bar 26GHz | RAM 16GB | 512GB PCIe SSD | 460 4GB Radeon Pro Space Gray",New MacBook Pro 15-inch Touch Bar to 26GHz Core i7 with 16GB of RAM and 512GB of SSD PCIe (MLH32Y / A),3179.0,2875.59,2158
APP1885,"Apple MacBook Pro 15 ""Core i7 Touch Bar 29GHz | RAM 16GB | 512GB PCIe SSD | Radeon Pro 450 2GB Silver",New MacBook Pro 15-inch Core i7 Touch Bar 29Ghz with 16GB of RAM and 512GB of SSD PCIe (MLH32Y / A),3319.0,3159.58,2158
APP1891,"Apple MacBook Pro 15 ""Core i7 Touch Bar 29GHz | 16GB RAM | 2TB PCIe SSD | Radeon Pro 460 4GB Silver",New MacBook Pro 15-inch Core i7 Touch Bar 29Ghz with 16GB of RAM and 2TB of SSD PCIe (MLH32Y / A),4999.0,4005.59,2158
APP1923,"Apple MacBook Pro 15 ""Core i7 Touch Bar 26GHz | RAM 16GB | 256GB PCIe SSD | 460 4GB Radeon Pro Space Gray",New MacBook Pro 15-inch Touch Bar to 26GHz Core i7 with 16GB of RAM and 256GB SSD PCIe (MLH32Y / A),2939.0,2798.58,2158
APP1924,"Apple MacBook Pro 15 ""Core i7 Touch Bar 26GHz | RAM 16GB | 256GB PCIe SSD | Radeon Pro 460 4GB Silver",New MacBook Pro 15-inch Touch Bar to 26GHz Core i7 with 16GB of RAM and 256GB SSD PCIe (MLW72Y / A),2939.0,2505.59,2158
