sku,name,desc,price,promo_price,type
LIF0097,LifeProof Fre Waterproof Case iPhone 6 / 6S White,waterproof and extreme conditions for iPhone 6 / 6S case.,79.99,54.99,11865403
LIF0098,LifeProof Fre Waterproof Case iPhone 6 / 6S Gray,waterproof case and extreme conditions for iPhone 6 / 6S.,79.99,46.99,11865403
LIF0099,LifeProof Fre Waterproof Case iPhone 6 / 6s Blue,waterproof and extreme conditions for iPhone 6 / 6S case.,79.99,59.99,11865403
WDT0312,Western Digital My Book Pro 12TB Thunderbolt 2,12TB external hard drive and dual Thunderbolt 2 port.,939.99,867.8,11935397
LIF0100,LifeProof Fre Waterproof Case iPhone 6 / 6S Lila Crushed,waterproof and extreme conditions for iPhone 6 / 6S case.,79.99,59.99,11865403
TUC0240,Housing Sottile Tucano iPhone 6 / 6S Plus Transparent,Transparent Cover for iPhone 6 / 6S Plus,9.9,7.99,11865403
TUC0230,Housing Flex Elektro Tucano iPhone 6 / 6S Transparent / Silver,Cover for iPhone 6 / 6S.,16.9,12.99,11865403
TUC0231,Housing Flex Elektro Tucano iPhone 6 / 6S Transparent / Gold,Cover for iPhone 6 / 6S.,16.9,12.99,11865403
TUC0234,Housing Flex Elektro Tucano iPhone 6 / 6S Plus Transparent / Gold,Cover for iPhone 6 / 6S Plus.,19.9,14.99,11865403
TUC0232,Housing Flex Elektro Tucano iPhone 6 / 6S Plus Transparent / Black,Cover for iPhone 6 / 6S Plus.,19.9,15.99,11865403
TUC0235,Tucano Book Cover iPhone 6 / 6S Black,cover with lid type card case book for iPhone 6 / 6S.,22.9,19.99,11865403
TUC0238,Housing Sottile Tucano iPhone 6 / 6S Transparent,Ultrathin Case for iPhone 6 / 6S.,7.9,6.99,11865403
THU0022,Thule Crossover Backpack 32L Black Macbook and iPad,resistant and waterproof 32 L Backpack for MacBook and iPad,129.95,92.99,1392
SPH0013,Sphero BB-8 Star Wars Robot,Smartoy sphere droid BB-8 Star Wars remote Bluetooth,169.95,154.99,11905404
MOS0168,Moshi iGlaze Armor Case for iPhone 6 / 6S Plus Copper Sunset,Adjustable thin aluminum casing for iPhone 6 / 6s,50.0,27.99,11865403
DEV0027,Devolo dLAN 500 duo PLC,PLC Network Adapter with WiFi and 2 Ethernet ports.,39.99,39.99,1334
ICA0061,"Incase Sling Sleeve Macbook Pro Deluxe briefcase / Retina 13 ""Black",briefcase removable straps and dual compartment Macbook Pro / Retina 13 inches,59.95,44.99,10230
ICA0068,"Incase Neoprene Sleeve Case Classic Macbook Air 11 ""Red",Neoprene sheath light flexibe macbook 11 inches.,39.95,22.99,13835403
ICA0069,"Incase Neoprene Sleeve Classic Red Plum Case Macbook Pro / Air / Retina 13 ""Red",Lightweight neoprene sleeve flexibe,39.95,29.9,13835403
MOS0172,Moshi iGlaze Case Napa iPhone 6 / 6S Midnight Blue,Double casing for iPhone protective layer 6 / 6S.,45.0,24.49,11865403
MOS0176,Moshi iGlaze Case Napa iPhone 6 / 6S Plus Black,Housing double protective coating for iPhone 6 / 6S Plus.,50.0,28.49,11865403
OTT0102,OtterBox iPhone Case My Symmetry 6 / 6s Transparent / Beige,Protective housing with rear transparent and customizable for iPhone 6 and 6s.,29.99,16.99,11865403
MOX0029,Moxie Pinza 3M Car Support Compatible with all iPhone,Car holder for iPhone 5 / 5S / 6 / 6S / 6 Plus / 6s Plus.,19.99,14.99,14365395
MOX0030,Moxie Car Support for compatible iPhone Volante,Support for Car Steering Wheel for iPhone 5 / 5S / 6 / 6S / 6 Plus / 6s Plus.,9.99,4.99,14365395
APP1201,"Apple iPad Pro 12.9 ""Wi-Fi 32GB Space Gray",Pro 12.9-inch new iPad Wi-Fi 32GB.,899.0,902.81,51861714
APP1206,"Apple iPad Pro 12.9 ""Wi-Fi 128GB Gold",New iPad Pro 12.9 inch 128GB Wi-Fi.,1009.0,1012.81,1714
APP1208,"Apple iPad Pro 12.9 ""Wi-Fi + Cellular 128GB Silver",Pro 12.9-inch new iPad Wi-Fi + Cellular 128GB.,1159.0,1162.81,1714
APP1209,"Apple iPad Pro 12.9 ""Wi-Fi + Cellular 128GB Gold",Pro 12.9-inch new iPad Wi-Fi + Cellular 128GB.,1159.0,1116.8,1714
JAB0045,Pace Jabra Sport Bluetooth Headphones In-ear Blue,Wireless and resistant to rain for iPhone and iPod headphones.,99.95,87.99,5384
TRA0040,"Transcend StoreJet outer box 25 ""Aluminum",external enclosure USB 2.5 inch disks 3.0.,14.99,14.99,12995397
JBL0110,JBL Press 2 Bluetooth Speaker Black,Bluetooth wireless speaker for iPhone iPad and iPod.,199.99,174.99,5398
QNA0146,QNAP UX-800P NAS Expansion Chassis,Expansion Chassis 8-bay NAS for Mac and PC.,756.25,755.99,1404
QNA0149,QNAP HS-251 + NAS Server Mac and PC,2-bay NAS server with HDMI for home.,398.99,354.99,12175397
PAC1212,QNAP Pack HS-251 + | WD 4TB Network,QNAP Pack HS-251 + with 4TB (2x2TB) Network WD Hard Drive for Mac and PC.,596.99,515.18,12175397
PAC1209,QNAP Pack HS-251 + | Seagate 4TB IronWolf,QNAP Pack HS-251 + with 4TB (2x2TB) IronWolf Seagate Hard Drive for Mac and PC.,618.97,509.18,12175397
PAC1213,QNAP Pack HS-251 + | WD 6TB Network,QNAP Pack HS-251 + with 6TB (2x3TB) Network WD Hard Drive for Mac and PC.,656.99,559.18,12175397
PAC1214,QNAP Pack HS-251 + | WD 8TB Network,QNAP Pack HS-251 + with 8TB (2x4TB) Network WD Hard Drive for Mac and PC.,736.99,607.18,12175397
PAC1215,QNAP Pack HS-251 + | WD 12TB Network,QNAP pack of 12TB (2x6TB) WD Hard Drives Network for Mac and PC.,908.99,735.18,12175397
PAC1629,QNAP HS-251 + | Seagate 12TB Iron Wolf,HS-251 + NAS with 12TB (2x6TB) IronWolf Seagate Hard Drives for Mac and PC,958.97,731.18,12175397
SAN0102,SanDisk Ultra SDHC Class 10 | 16 GB,SDHC Memory Card Class 10 16GB transfer rate of 80MB / s,9.09,11.0,57445397
SNA0058,Sena UltraSlim Case Heritage iPhone 6 / 6S / 7 brown,ultra thin skin iPhone 6 / 6s and 7 Case,39.95,29.9,11865403
GRT0393,Griffin WatchStand charging base Apple Watch / iPhone Black,Charging Dock for iPhone Apple Watch i.,59.99,54.99,24215399
CRU0049,Crucial Mac Memory 8GB DDR3 1867MHz SO-DIMM,8GB 1867MHz RAM for Mac.,91.36,91.36,1364
GRT0392,Griffin Survivor Case Tactical Apple Watch 38mm Black,Anti-shock Case with Screen Protector for Apple Watch.,34.99,19.99,2434
KEN0232,VM4000 Kensington Mini Display Port Adapter to HDMI 4K,4K resolution video adapter Mini Display to HDMI.,36.99,29.99,12585395
LOG0190,Logitech Keyboard K380 Multi-Device Black for iPad / iPhone / Mac,Spanish wireless keyboard and multi device iPad / iPhone / Mac,46.99,46.99,13855401
PHI0059,Philips Hue White and Color Light Bulb GU10 6.5W Single,Single LED bulb with up to 16 million colors for iPhone iPad and iPod,59.99,52.99,11905404
APP0692-A,Open - Apple (OEM) cable connector to USB 1m White Lightning,Lightning USB cable 1 meter to charge and sync iPhone iPad and iPod (unboxed).,25.0,9.99,1298
OWC0001-A,Open - OWC Data Doubler Optical Bay adapter Macbook / Macbook Pro,Tray SuperDrive replacement hard drive or SSD,72.99,20.84,1298
APP0694-A,"Open - Apple (OEM) Charger 85W MagSafe 2 Retina display MacBook Pro 15 """,MagSafe charger 2 of 85 W (MD506Z / A) Without box.,89.0,69.99,1298
APP0695-A,Open - OEM 45W MagSafe 2 charger MacBook Air in June 2012,Charger MacBook Air MagSafe 2 of 45 W (MD592Z / A) Without box.,89.0,54.78,1298
OLL0011-A,(Open) Olloclip 4-in-1 lens iPhone 6 / 6S and 6 / 6S Plus Gold / White,gLente wide angle lens macro fisheye and macro x15 x10 iPhone 6 / 6S and 6 / 6S Plus Plus.,79.99,52.96,1298
APP1101-A,Open - Apple (OEM) Charger 45W MagSafe MacBook Air,Charger MacBook Air MagSafe 45 W (MC747Z / A).,89.0,69.99,1298
WDT0257-A,Open - Western Digital 1TB My Passport Wireless Hard Drive Mac and PC,Wireless WD External Hard Drive Refurbished Mac and PC.,199.0,139.99,11935397
LOG0191,Ultimate Ears Boom 2 Bluetooth Portable Speaker Black / Gray,Bluetooth portable speaker waterproof black color for iPhone iPad and iPod,209.0,149.99,5398
LOG0192,Ultimate Ears Boom 2 Bluetooth Portable Speaker Green / Blue,Logitech Bluetooth speaker with Micro waterproof iPhone iPad and iPod USB.,209.0,149.99,5398
LOG0194,Ultimate Ears Boom 2 Bluetooth Portable Speaker Pink / Red,Logitech Bluetooth speaker with Micro waterproof iPhone iPad and iPod USB.,209.0,149.99,5398
CRU0043-2,Crucial memory Mac 16GB (2x8GB) SO-DIMM DDR3 1867MHZ,RAM 16GB (2x8GB) 1867MHz for Mac.,159.98,158.99,1364
GRT0395,Griffin Survivor Case Tactical Apple Watch 42mm White,Anti-shock Case with Screen Protector for Apple Watch.,34.99,19.99,2434
SAN0092,SanDisk Ultra USB 3.0 128GB pendrive,Pendrive USB 3.0 Flash Drive 128G for Mac and PC.,44.99,47.0,11935397
UAG0025,Urban Armor Gear Case iPad mini resistant 4 Red,resistant cover and light sheet format for iPad Mini 4.,49.95,29.99,12635403
CRU0043-4,Crucial memory Mac 32GB (4x8GB) SO-DIMM DDR3 1867MHZ,RAM 32GB (4x8GB) 1867MHz for Mac.,319.96,318.99,1364
GRT0388,Griffin Survivor Case Tough Journey iPhone 6 / 6S Gray / Pink,Thin casing absorbs impact iPhone 6 / 6s.,29.99,12.99,11865403
GRT0389,Griffin Survivor Case Tough Journey iPhone 6 / 6S Black / Blue,Thin casing absorbs impact iPhone 6 / 6s.,29.99,10.99,11865403
GRT0391,Griffin Survivor Case Tough Journey iPhone 6 / 6S Black / White,Thin casing absorbs impact iPhone 6 / 6s.,29.99,16.99,11865403
TUC0244,Slim Briefcase Dark Tucano MacBook / iPad Black Pro,Slim shoulder MacBook Retina 12-inch Retina / Pro 13-inch and 12.9-inch iPad Pro,49.99,39.99,10230
JMO0081,Just Mobile Tenc Case iPhone 6 / 6S Black Matte,Polycarbonate shell with self-heal for iPhone 6 / 6S.,24.99,21.99,11865403
JMO0082,Just Mobile Tenc Case iPhone 6 / 6S Plus Crystal Clear,Polycarbonate shell with self-Heald for iPhone 6 / 6S Plus.,29.99,19.99,11865403
JMO0083,Just Mobile Tenc Case iPhone 6 / 6S Plus Matte Black,Polycarbonate shell with self-Heald for iPhone 6 / 6S Plus.,29.99,26.99,11865403
JMO0084,Just Mobile Tenc Case iPhone 6 / 6S Plus Matte Transparent,Polycarbonate shell with self-Heald for iPhone 6 / 6S Plus.,29.99,26.99,11865403
XDO0027,"X-Doria Dash Folio iPad Case Spin Pro 129 ""Black",Leather Case for iPad Pro 129 inches.,49.99,29.99,12635403
IKM0053,Ik Multimedia iRig Acoustic,Microphone and Guitar iPhone iPad iPod.,60.99,45.99,11905404
ADN0035,Adonit Jot Pro Stylus Pointer Rose Gold 2.0,Professional pointer for iPad and iPhone.,29.99,22.99,1229
BNQ0043,"LED Monitor Benq GW2270 215 ""DVI VGA",LED 215-inch monitor flicker-free technology and soft blue light mode.,115.0,104.99,1296
BNQ0044,"LED Monitor Benq GW2270H 215 ""HDMI",LED 215-inch monitor flicker-free technology and soft blue light mode.,104.99,109.0,1296
PAC1308,Pack QNAP TS-451 + | 8GB RAM | Seagate 12TB IronWolf,Pack QNAP TS-451 + with 8GB of RAM memory + 12TB (4x3TB) IronWolf Seagate Hard Drive Desktop for Mac and PC.,1159.95,974.37,12175397
PAC1312,Pack QNAP TS-451 + | 8GB RAM | WD 16TB Network,Pack QNAP TS-451 + with 8GB of RAM memory + 16TB (4x4TB) Network WD Hard Drive for Mac and PC.,1275.99,1094.37,12175397
PAC1313,Pack QNAP TS-451 + | 8GB RAM | WD 24TB Network,Pack QNAP TS-451 + with 8GB of RAM memory + 24TB (4x6TB) Network WD Hard Drive for Mac and PC.,1619.99,1350.37,12175397
PAC1302,Pack QNAP TS-451 + | 2GB RAM + WD 8TB Red,Pack QNAP TS-451 + with 2GB of RAM memory + 8TB (4x2TB) Network WD Hard Drive for Mac and PC.,874.99,792.37,12175397
PAC1300,Pack QNAP TS-451 + | 2GB RAM | Seagate 12TB IronWolf,Pack QNAP TS-451 + with 2GB of RAM memory + 12TB (4x3TB) IronWolf Seagate Hard Drive Desktop for Mac and PC.,1038.95,854.37,12175397
PAC1306,Pack NAS QNAP TS-451 + Server 8GB RAM,Pack NAS QNAP TS-451 + with 8GB of RAM for Mac and PC.,599.99,588.99,12175397
QNA0152,QNAP TS-451 + NAS | 2GB RAM Mac and PC,4-bay NAS server 2GB RAM and remote for Mac and PC.,478.99,469.99,12175397
SAN0110,SanDisk Ultra Flair Flash Drive 16GB USB 3.0,USB 3.0 flash drive 16GB USB Flash Drive Mac and PC.,8.99,9.0,11935397
SAN0111,SanDisk Ultra Flair Flash Drive 32GB USB 3.0,USB 3.0 flash drive 32GB USB Flash Drive Mac and PC.,13.99,15.0,11935397
MDT0008,Mediterrans cover iPhone 5 / 5S / SE brown Chocolate,Cover with matte finishes for iPhone 5 / 5S.,19.0,11.5,11865403
MDT0009,Mediterrans cover iPhone 5 / 5S / SE White Mate,Funda iPhone 5 / 5S / SE White Matte.,19.0,11.5,11865403
MDT0011,Mediterrans cover iPhone 6 / 6S brown Chocolate,Cover with matte finishes for iPhone 6 / 6S.,19.0,14.99,11865403
MDT0012,Mediterrans cover iPhone 6 / 6S White Mate,Funda iPhone 6 / 6S White Matte.,19.0,9.99,11865403
MDT0014,Mediterrans founded iPhone 6 / 6S Rosa Flamenco,Cover with matte finishes for iPhone 6 / 6S.,19.0,11.5,11865403
MDT0015,Mediterrans cover iPhone 6 / 6S Plus Black Night,Cover with matte finishes for iPhone 6 / 6S Plus.,19.0,9.99,11865403
QNA0150,QNAP TS-251 + NAS | 2GB RAM Mac and PC,2-bay NAS server 2GB RAM and remote for Mac and PC.,349.0,334.99,12175397
PAC1226,Pack QNAP TS-251 + | 2GB RAM | Seagate 4TB IronWolf,Pack NAS QNAP TS-251 + 2GB RAM + 4TB (2x2TB) IronWolf Seagate Hard Drive for Mac and PC.,568.98,489.18,12175397
PAC1228,Pack QNAP TS-251 + | 2GB RAM | 8TB Seagate Desktop IronWolf,Pack QNAP TS-251 + with 2GB of RAM memory + 8TB (2x4TB) IronWolf Seagate Hard Drive for Mac and PC.,708.98,560.18,12175397
PAC1229,Pack QNAP TS-251 + | 2GB RAM | WD 4TB Network,Pack QNAP TS-251 + 2GB RAM + memoriam 4TB (2x2TB) Network WD Hard Drive for Mac and PC.,547.0,495.18,12175397
PAC1230,Pack QNAP TS-251 + | 2GB RAM | WD 6TB Network,Pack NAS QNAP TS-251 + 2GB RAM memory + 6TB (2x3TB) Hard Red WD Mac and PC.,607.0,539.18,12175397
PAC1231,Pack QNAP TS-251 + | 2GB RAM | WD 8TB Network,Pack NAS QNAP TS-251 + 2GB RAM + 8TB (2x4TB) Network WD Hard Drive for Mac and PC.,687.0,587.18,12175397
PAC1388,Pack QNAP TS-251 + | 2GB RAM | WD 16TB Network,Nas QNAP TS-251 + 2GB RAM memory + 16TB (2x8TB) Hard Red WD Mac and PC.,673.7,815.18,12175397
PAC1292,Pack QNAP TS-251 + | 8GB RAM | Seagate 4TB IronWolf,QNAP TS-251 Pack + 8GB RAM + 4TB (2x2TB) IronWolf Seagate Hard Drive for Mac and PC.,719.97,621.18,12175397
PAC1295,Pack QNAP TS-251 + | 8GB RAM | WD 4TB Network,Pack QNAP TS-251 + 8 + 4TB GB of RAM memory (2x2TB) WD Network for Mac and PC.,697.99,628.18,12175397
PAC1296,Pack QNAP TS-251 + | 8GB RAM | WD 6TB Network,Pack QNAP TS-251 + with 8GB RAM memory + 6TB (2x3TB) Hard Red WD Mac and PC.,757.99,671.18,12175397
PAC1297,Pack QNAP TS-251 + | 8GB RAM | WD 8TB Network,Pack QNAP TS-251 + 8 + 8 TB GB RAM memory (2x4TB) Hard Red WD Mac and PC.,837.99,719.18,12175397
PAC1291,QNAP TS-251 + | 8GB RAM,Pack 2-bay NAS server + 8GB of RAM for Mac and PC.,499.99,466.99,12175397
PAC1637,Pack QNAP TS-451 + | 8GB RAM | Seagate NAS 32TB,TS-451 + NAS with 24TB + 8GB RAM memory (4x6TB) NAS IronWolf Seagate Hard Drive for Mac and PC,1719.95,1341.37,12175397
KIN0135,Kingston Secure Digital Memory Card SDXC Class 10 | 64GB,SDXC Memory Card Class 10 64GB speeds 45MB / 10MB,29.99,26.28,57445397
SAN0112,SanDisk Ultra Flair Flash Drive 64GB USB 3.0,USB 3.0 flash drive 64GB USB Flash Drive Mac and PC.,24.99,25.0,57445397
SAN0113,SanDisk Ultra Flair Flash Drive 128GB USB 3.0,Pendrive USB 3.0 128GB USB Flash Drive Mac and PC.,49.99,50.0,11935397
KIN0137,Kingston Memory Card microSDHC UHS Class 1 | 16 GB,MicroSDHC Memory Card 16GB UHS Class 1 with speeds of 45MB / 10MB,8.99,9.28,57445397
KIN0138,Kingston microSDHC memory card 32GB UHS Class 1,Memory card microSDHC UHS Class 1 32GB with transfer rates of 45MB / 10MB,13.45,16.28,57445397
KIN0140,Kingston Memory Card microSDXC UHS Class 1 | 128GB,Memory card microSDXC UHS Class 1 128GB with transfer rates of 45MB / 10MB,69.99,50.28,57445397
KIN0142,Kingston Memory Card microSDHC UHS Class 1 | 32GB,Micro SDHC Memory Card 32GB Class 1 with speeds of 90MB / 45MB,18.99,18.28,57445397
KIN0143,Kingston Memory Card microSDXC UHS Class 1 | 64GB,MicroSDXC memory card UHS Class 1 with speeds of 90MB / 45MB,36.99,36.28,57445397
KIN0144,Kingston microSDHC Memory Card Class 10 UHS-I | 32GB,MicroSDHC memory card class 10 UHS-I 32GB speeds 90MB / 80MB,17.99,20.28,57445397
KIN0145,Kingston Memory Card microSDXC UHS Class 3 | 64GB,Memory card microSDXC UHS Class 3 64GB speeds 90MB / 80MB,42.99,38.28,57445397
LMP0001-A,Open - LMP Bluetooth Keypad KeyPad Mac,Expansion keypad with bluetooth connection.,54.99,34.99,1298
OTR0039-A,Open - External Slim Case for SuperDrive MacBook / MacBook Pro,Reconditioned external box SuperDrive for MacBook and MacBook Pro,35.0,16.06,12995397
KAN0022-A,Open - Kanex adapter Thunderbolt to Ethernet + USB 3.0 Gigabyte,Gigabyte Thunderbolt adapter cable to Ethernet + USB 3.0.,119.99,90.33,1298
KUA0015-A,Open - Kukaclip car + Support iPhone 6 Plus Case Black,Magnetic car holder with 360 degrees rotating Cover for iPhone 6 Plus,24.99,5.04,1298
APP0903-A,Open - Apple Mac mini Core i5 14GHz | 8GB RAM | 500GB HDD,PC Mac Mini i5 14GHz 8GB 500GB (MGEM2YP / A).,675.59,597.88,1298
SEA0038-A,"Open - Seagate Barracuda 3TB 35 ""SATA 7200rpm hard drive Mac and PC",internal hard drive Mac and PC 3TB (ST3000DM001).,112.0,79.64,1298
ELG0033-A,Open - Elgato Eve and Energy Plug Power Wireless Sensor,Control on and off and sensor power consumption and Remote for iPhone iPad iPod Touch and Apple Watch.,49.99,43.57,11905404
OWC0018-A,Open - OWC Mount Adapter 25-35 Pro Mac Pro (2009-2012),SSD or hard drive for Mac Pro 2.5 refitted adapter.,35.99,25.99,1298
ADN0037,Adonit Jot Pro Stylus Pointer 2.0 Copper,Professional pointer for iPad and iPhone.,29.99,20.99,1229
IKM0051,IK Multimedia iRig Keys USB controller 25 25 mini keys for Mac iPad iPhone iPod,Mini keyboard with 25 keys for Mac iPhone iPad and iPod.,73.19,55.99,11905404
SNA0059,Sena UltraSlim Case Heritage iPhone 6 / 6S / 7 Black,Ultra Thin Skin Case for iPhone 6 / 6S.,39.95,29.9,11865403
SNA0060,Sena Magnetic Holster Case iPhone 6 / 6S Black,Cover book format with magnetic closure for iPhone 6 / 6S.,49.95,46.9,11865403
CYG0072,Cygnett Luxband Apple Watch Strap 42mm brown,Leather strap for easy installation Apple Watch 42mm.,49.99,39.99,2449
CYG0073,Cygnett Luxband Apple Watch Strap Black 42mm,Leather strap for easy installation Apple Watch 42mm.,49.99,23.99,2449
CYG0071,Cygnett Luxlink Metal strap for Apple Watch 42mm Silver,Metal strap for easy installation Apple Watch 42mm.,59.99,38.99,2449
CYG0074,Cygnett SuperCharger 5 USB ports UFO White,5 USB ports charger.,34.99,25.99,13615399
XDO0034,"X-Doria Engage Folio iPad Pro 129 ""White",Leather Case for iPad Pro 129 inches.,34.99,22.99,12635403
IKM0052,Ik Multimedia iRig Mic lavalier Lav,iPhone iPad and iPod microphone.,60.99,44.99,11905404
SPE0163,"Speck SeeThru Case Macbook Pro Retina 15 ""Gray",Protective Cover for MacBook Pro Retina 15 inches.,49.9,36.99,13835403
SPE0165,"Speck SeeThru Case Macbook Pro Retina 13 ""Gray",Protective Cover for MacBook Pro Retina 13 inches.,49.9,36.99,13835403
SPE0166,"Speck SeeThru Case Macbook Pro Retina 13 ""Cobalt Blue",Protective Cover for MacBook Pro Retina 13 inches.,49.9,36.99,13835403
SPE0159,"Speck SeeThru Case Macbook Retina 12 ""Black",Protective case for MacBook 12 inches.,49.9,39.99,13835403
SPE0160,"Speck SeeThru housing Macbook Retina 12 ""Transparent",Protective case for MacBook 12 inches.,49.9,36.99,13835403
ZAG0024,"Zagg iPad Messenger Universal Keyboard Pro 129 ""Black",Spanish Bluetooth keyboard for iPad Pro resistant sheath 129 inches.,89.99,34.99,12575403
JAB0046,Jabra Bluetooth Headset Eclipse Ultra Light Black,ultralight Bluetooth Handsfree Headset for iPhone iPad iPod Touch.,99.95,87.99,5384
QNA0154,QNAP TS-253A | 4GB RAM Mac and PC Server Nas,2-bay NAS server for Mac and PC,389.99,332.99,12175397
PAC1317,Pack QNAP TS-253A | 4GB RAM | WD 4TB Network,QNAP Pack + 4GB memory RAM + 4TB (2x2TB) Network WD Hard Drive for Mac and PC.,587.99,494.18,12175397
PAC1318,Pack QNAP TS-253A | 4GB RAM | WD 6TB Network,QNAP pack with 4GB of RAM memory + 6TB (2x3TB) Network WD Hard Drive for Mac and PC.,647.99,537.18,12175397
PAC1319,Pack QNAP TS-253A | 4GB RAM | WD 8TB Network,QNAP pack with 4GB of RAM memory + 8TB (2x4TB) Network WD Hard Drive for Mac and PC.,727.99,585.18,12175397
PAC1316,Pack QNAP TS-253A | 4GB RAM | Seagate 8TB IronWolf,QNAP Pack + 4GB memory RAM + 8TB (2x4TB) IronWolf Seagate Hard Drive for Mac and PC.,749.97,559.18,12175397
QNA0161,Pack QNAP TS-253A | 8GB RAM,QNAP NAS Pack + 8GB of RAM for Mac and PC,543.29,449.99,12175397
PAC1324,Pack QNAP TS-253A | 8GB RAM | Seagate 8TB IronWolf,QNAP NAS Pack + 8GB + RAM memory Hard Drive 8TB (2x4TB) Seagate IronWolf for Mac and PC.,903.27,674.18,12175397
PAC1325,Pack QNAP TS-253A | 8GB RAM | WD 4TB Network,QNAP NAS Pack + 8GB + RAM memory drives 4TB (2x2TB) WD Red for Mac and PC,741.29,609.18,12175397
PAC1326,Pack QNAP TS-253A | 8GB RAM | WD 6TB Network,QNAP NAS Pack + 8GB + RAM memory Hard Drive 6TB (2x3TB) WD Red for Mac and PC,801.29,652.18,12175397
PAC1647,QNAP TS-253A | 16GB RAM,NAS TS-253A with 16GB of RAM for Mac and PC,528.08,526.99,12175397
PAC1643,Pack QNAP TS-253A | 4GB RAM | 8TB Seagate Desktop,QNAP Pack + 8GB Memory RAM + 12TB (2x6TB) Seagate Hard Drive for Mac and PC IronWolf,1103.27,824.18,12175397
QNA0155,QNAP TS-453A | 4GB RAM Mac and PC Server NAS,4-bay NAS Server for Mac and PC.,529.99,456.99,12175397
PAC1331,Pack QNAP TS-453A | 4GB RAM | Seagate 16TB IronWolf,Pack NAS QNAP TS-453A with 4GB of RAM + memory drives 16TB (4x4TB) Seagate IronWolf for Mac and PC,1249.95,909.37,12175397
PAC1332,Pack QNAP TS-453A | 4GB RAM | WD 8TB Network,Pack NAS QNAP TS-453A with 4GB of RAM + memory drives 8TB (4x2TB) WD Network for Mac and PC.,925.99,778.37,12175397
PAC1333,Pack QNAP TS-453A | 4GB RAM | WD 12TB Network,Pack NAS QNAP TS-453A with 4GB of RAM memory Hard + 12TB (4x3TB) WD Network Drive for Mac and PC.,1045.99,865.37,12175397
PAC1334,Pack QNAP TS-453A | 4GB RAM | WD 16TB Network,QNAP NAS TS-453A with 4GB of RAM Memory Hard + 16TB (4x4TB) Network WD Drive for Mac and PC,1205.99,961.37,12175397
QNA0162,Pack QNAP TS-453A | 8GB RAM,Pack NAS QNAP TS-453A with 8GB of RAM for Mac and PC.,700.59,699.99,12175397
PAC1339,Pack QNAP TS-453A | 8GB RAM | Seagate 16TB IronWolf,Pack NAS QNAP TS-453A with 8GB of RAM + memory drives 16TB (4x4TB) Seagate IronWolf for Mac and PC,1420.55,1152.37,12175397
PAC1342,Pack QNAP TS-453A | 8GB RAM | WD 16TB Network,Pack NAS QNAP TS-453A with 8GB of RAM memory + 16TB (4x4TB) Network WD Hard Drive for Mac and PC.,1376.59,1203.37,12175397
PAC1670,QNAP TS-453A | 16GB RAM | Seagate 16TB Iron Wolf,NAS QNAP TS-453A with 16GB of RAM memory + 16TB (4x4TB) IronWolf Seagate Drives for Mac and PC,1393.24,1320.37,12175397
QNA0157,QNAP TS-853A | 4GB RAM Mac and PC Server NAS,8-bay NAS Server for Mac and PC.,966.79,965.99,12175397
DLL0030,"Dell UltraSharp Monitor UP2516D 25 ""QHD 2 HDMI HDMI 4 USB3.0",Monitor with slim frame premier technology height adjustable color tilt and rotation pivotable Adobe sRGB 100% for Mac and PC,527.99,469.99,1296
DLL0031,"Dell UltraSharp Monitor UP2716D 27 ""QHD 2 HDMI HDMI 4 USB3.0",Monitor with slim frame premier technology height adjustable color tilt and rotation pivotable Adobe sRGB 100% for Mac and PC,683.99,599.99,1296
PHI0061,Philips HUE Bridge 2.0 for lamps and bulbs Hue,Bridge intelligent control of lights and accessories compatible with HomeKit Hue,59.95,49.9,11905404
PHI0063,Philips Hue White Single Bulb E27 9.5W A60,White bulb High quality and comfortable regulation,19.95,18.99,11905404
SAN0140,SanDisk Ultra 32GB microSDHC Memory Card + SD Adapter,Adapter and microSDHC memory card 32 GB Class 10 UHS-1with transfer rate 80MB / s,12.99,15.28,57445397
PHI0062,Philips Hue Dimmer light dimmer switch White,Remote control to control lamps and bulbs Hue,24.95,24.99,11905404
PHI0078,Philips Hue White and Color Starter Kit Starter 10w E27 + A60 Bridge,Set of three white light bulbs and switch colors with Hue Bridge System,199.95,168.99,11905404
PHI0060,Philips Hue smart switch Tap Wireless Controller,intelligent wireless control switch with four scenes,59.95,52.99,11905404
PHI0066,Philips Hue GU10 6.5W White and Color Starter Kit 3 bulbs + Bridge,Three bulbs kit color + Bridge for Philips Hue lighting system.,199.95,179.99,11905404
PHI0067,Philips HUE LightStrips Plus LEDs Strip 2m,LEDS strip with maximum flexibility and 2 meters long,79.95,78.99,11905404
PHI0068,Philips HUE LightStrips Plus LEDs Strip 1m extension,LEDS strip with maximum flexibility and 1 meter in length,24.95,22.99,11905404
PHI0069,Philips Hue White 9.5W E27 A60 Single + Dimmer Switch,Independent bulb set white + remote control for lamps and bulbs Hue,39.95,34.99,11905404
OWC0133,Aura OWC 1TB SSD for Apple Mac Pro 2013 + Tools + Case,1TB SSD HDD with tools and housing for Mac Pro 2013.,1209.99,999.99,12215397
OWC0134,OWC Aura 2TB SSD for Apple Mac Pro 2013 + Tools + Case,SSD Hard Drive 2TB with tools and housing for Mac Pro 2013.,1955.99,1621.58,12215397
DLK0103,D-Link mydlink Home DCH-S220 Sirena Wi-Fi,Smart Wifi siren with 6 types of sounds.,54.0,54.0,11905404
KIN0147,Kingston Ultimate SDXC Memory Card UHS Class 1 | 128GB,SDXC Memory Card UHS Class 1 128GB with speeds of 90MB / 45MB,64.99,60.28,57445397
DLK0107,D-Link DHP-P509AV PowerLine AV 500 Passthrough Starter Kit HD,Internet amplifier kit with integrated socket.,42.99,41.99,1334
DLK0108,D-Link DHP-P601AV PowerLine Gigabit AV2 1000 HD Passthrough Kit,Internet amplifier kit with integrated socket.,61.99,61.99,1334
DLK0100,D-Link DAP-1620 Wi-Fi AC1200 Amplifier,Wireless network amplifier Dual band technology.,53.99,48.99,1334
DLK0106,D-Link DHP-601AV PowerLine Gigabit AV2 1000 HD Starter Kit,Amplifier internet with speeds of 1000Mbps.,90.99,42.99,1334
DLK0109,D-Link DIR-842 Wi-Fi Router AC1200 Dual Band Gigabit,Dual-Band WiFi router with Gigabit Ethernet ports.,59.99,56.99,1334
BOO0089,"Booq Viper Hardcase Case Macbook Retina 12 ""Graphite",rigid sleeve compact plastic nylon.,45.0,44.99,13835403
SYN0130,Synology DS216 NAS server Mac and PC,NAS server for high-performance home and small offices.,290.99,289.99,12175397
PAC1347,Synology DS216 Pack | WD 4TB Network,Synology DS216 + Pack 4TB (2x2TB) WD Red hard drives for Mac and PC.,488.99,447.18,12175397
PAC1349,Synology DS216 Pack | WD 8TB Network,Pack Synology NAS + 4TB 2 Discs (2x4TB) WD Network for Mac and PC.,628.99,550.18,12175397
PAC1350,Synology DS216 Pack | WD 12TB Network,Pack Synology NAS + 2 Discs 6TB (2x6TB) WD Network for Mac and PC.,800.99,675.18,12175397
PAC1840,Synology DS216 | 16TB (2x8TB) WD Red,Synology NAS 16TB (2x8TB) WD Red hard drives for Mac and PC,1008.99,790.18,12175397
