sku,name,desc,price,promo_price,type
RAI0007,Silver Rain Design mStand Support,Aluminum support compatible with all MacBook,59.99,49.99,8696
APP0023,Apple Mac Keyboard Keypad Spanish,USB ultrathin keyboard Apple Mac Spanish.,59.0,59.0,13855401
APP0025,Mighty Mouse Apple Mouse for Mac,mouse Apple USB cable.,59.0,56.99,1387
APP0072,Apple Dock to USB Cable iPhone and iPod white,IPhone dock and USB Cable Apple iPod.,25.0,23.0,1230
KIN0007,Mac Memory Kingston 2GB 667MHz DDR2 SO-DIMM,2GB RAM Mac mini and iMac (2006/07) MacBook Pro (2006/07/08).,34.99,31.99,1364
APP0073,Apple Composite AV Cable iPhone and iPod white,IPhone and iPod AV Cable Dock to Composite Video.,45.0,42.0,1230
KIN0001-2,Mac memory Kingston 4GB (2x2GB) 667MHz DDR2 SO-DIMM,RAM 4GB (2x2GB) Mac mini and iMac (2006/07) MacBook Pro (2006/07/08).,74.0,66.99,1364
APP0100,Apple Adapter Mini Display Port to VGA,Adapter Mini Display Port to VGA MacBook and MacBook Pro (unibody).,35.0,33.0,1325
APP0101,Apple Mini DisplayPort to DVI Adapter,Adapter mini DisplayPort to DVI MacBook and MacBook Pro (unibody).,35.0,33.0,1325
APP0111,Apple USB Ethernet Adapter Mac,USB to Ethernet adapter Mac.,35.0,33.0,1334
APP0156,45W MagSafe charger Apple MacBook Air,Charger MacBook Air MagSafe 45 W (MC747Z / A).,89.0,84.99,13005399
MOS0013,Adapter Moshi FireWire 400 to FireWire 800,FireWire 400 adapter cable FireWire 800.,20.0,17.99,1325
MOS0021,Clearguard Moshi MacBook Pro and Air,Keyboard Protector MacBook Pro 13-inch Retina 15 inches 17 inches 13 inches 15 inches and 13-inch Air.,24.95,24.99,13835403
APP0206,"60W MagSafe charger Apple MacBook and MacBook Pro 13 """,Charger MacBook and 13 inch MacBook MagSafe 60 W (MC461Z / A).,89.0,84.99,13005399
HGD0007,"Henge Docks Docking Station MacBook Pro 13 """,Dock and support with multiple connections for MacBook Pro 13-inch.,69.99,69.99,12995397
APP0234,Apple Dock Connector to VGA,Dock Connector to VGA IOS.,35.0,35.0,13955395
APP0247,"85W MagSafe charger Apple MacBook Pro 15 ""/ 17""",Charger MacBook Pro MagSafe 85 W (MC556Z / A).,89.0,84.99,13005399
APP0280,Apple HDMI to HDMI Cable 1.8m,HMDI to HDMI Cable 1.8m.,25.0,24.0,1325
SNN0007,Sonnet Tempo SATA PCIe Mac and PC E2P,PCIe Card with 2 Serial ATA ports Mac and PC.,59.99,50.21,1276
BEL0070,Music Receiver Belkin iPhone music receiver,Music Receiver iPhone iPad and iPod Touch for stereos via Bluetooth,49.99,29.99,11905404
LMP0007,KeyPad LMP Bluetooth Keypad Mac,expansion keypad Mac with bluetooth connection.,54.99,39.99,13855401
APP0308,AV Cable Adapter Apple iPhone iPad and iPod white,IPhone iPad iPod adapter and AV cable.,45.0,36.0,1230
GRT0196,Griffin Survivor Extreme-Duty Case iPad 2 3 and 4 black,IPad 2 Case 3 and 4 for extreme ultra resistant.,64.99,49.99,12635403
MUV0023,Extreme Muvit iPhone and iPod BikeMount sleeve black Touch,IPhone and iPod support sleeve waterproof App Touch and bicycle.,35.9,16.99,11865403
JMO0026,Just Mobile Lazy Couch Support Mac and iPad,Mac and iPad small lift stand.,19.95,19.99,8696
OWC0007,OWC Data Doubler Optical Bay adapter Macbook / Macbook Pro,Tray SuperDrive replacement hard disk or SSD.,72.99,39.99,12755395
KEN0028,Kensington ClickSafe lock Mac and PC,Mac and PC padlock with keys.,54.99,49.99,1325
APP0343,Apple Thunderbolt Cable 2m White,Cable Mac Apple Thunderbolt 2m.,45.0,43.0,1325
TWS0027,"Twelve South BookBook Case MacBook Air / Pro 13 ""brown",Funda Macbook Air / Pro 13 inch vintage leather with padded interior.,79.99,74.99,13835403
APP0367,Apple Mini DisplayPort to DVI Adapter Mac dual channel,Adapter Mini Display Port to DVI dual channel MacBook MacBook Pro and MacBook Air.,119.0,112.0,1325
KIN0002-2,Mac memory Kingston 2GB (2x1GB) 667MHz DDR2 SO-DIMM,RAM 2GB (2x1GB) Mac mini and iMac (2006/07) MacBook Pro (2006/07/08).,37.98,28.99,1364
KIN0003-2,Mac memory Kingston 4GB (2x2gb) SO-DIMM DDR2 800MHz,RAM 4GB (2x2gb) iMac with Intel Core 2 Duo (Penryn).,73.98,53.99,1364
MOS0065,Moshi TeraGlove cleaner screens,Microfibre screen cleaner for Mac iPhone iPad and iPod.,20.0,14.99,12355400
WAC0032,Wacom Bamboo Stylus Pack 3 first generation tips,3 Pack Bamboo Stylus pen tips iPad iPhone and iPod Touch.,4.99,4.99,1229
SPE0045,"Speck SeeThru Satin Case Macbook Air 11 ""Black",rigid housing MacBook Air 11 inches,49.9,39.99,13835403
LAC0141,LaCie Porsche Design 1TB External Hard Drive Mac and PC,External Hard Drive Mac and PC USB 3.0 1TB,79.99,77.79,11935397
HGD0012,Henge Docks Click keyboard support iMac,Base to hold the Apple Magic TrackPad and Wireless Keyboard Dock,29.0,26.99,8696
MAK0007,Maclocks theft case iPad 2 3 and 4 transparent rotary support,Case antitheft iPad 2 3 and 4 polycarbonate rotary support.,120.0,108.0,12635403
SEA0039,"Seagate Barracuda 2TB 35 ""SATA hard drive Mac and PC",Internal Hard Drive 2TB Mac and PC (ST2000DM006),89.99,63.99,12655397
SYN0047,Synology Pack 1 license for IP camera,1 Pack license Mac and PC camera.,52.99,52.99,1404
SYN0048,Synology Pack 4 IP camera licenses,4 Pack licenses Mac and PC camera.,181.99,181.98,1404
WAC0040,Wacom Bamboo Wireless Kit / Intuos graphics tablet accessory kit 5,Wireless Kit Wacom graphics tablets.,39.99,36.99,101781405
WAC0045,Wacom Intuos Airbrush stylus 4/5,stylus for pen tablets Cintiq 21UX Intuos 4/5 - 24HD,109.9,99.99,1229
WAC0046,Intuos Wacom stylus ArtPen 5/4,special stylus Mac and PC for Intuos4 graphics tablet / 5.,109.9,99.99,1229
SEA0044,"Seagate Barracuda 3TB 35 ""SATA hard drive Mac and PC",internal hard drive Mac and PC 3TB (ST3000DM008).,112.0,84.9,12655397
OTR0045,External Slim Case for SuperDrive MacBook / MacBook Pro,External SuperDrive case for MacBook and MacBook Pro.,35.0,29.99,12995397
IKM0013,IK Multimedia iRig MIX DJ Mixer iPhone iPad and iPod,Dj mixer iPhone iPad and iPod.,121.99,51.99,11905404
IKM0014,IK Multimedia iRig Stomp Guitar Pedal iPhone iPad and iPod,Guitar Pedal iPhone iPad and iPod.,73.19,53.99,11905404
IKM0015,IK Multimedia iRig PRE microphone adapter iPhone iPad and iPod,Microphone Adapter iPhone iPad and iPod.,48.79,34.99,11905404
IKM0016,IK Multimedia iRig MIC Cast iPhone iPad and iPod microphone,iPhone iPad and iPod microphone.,48.79,33.99,11905404
PAC0023,OWC Data Doubler Pack MacBook / MacBook Pro,Pack Replacement Superdrive for SSD / HDD + box Super Slim Superdrive + Tools.,107.99,55.99,12755395
HGD0015,"Henge Docks Docking Station MacBook Air 13 """,Dock MacBook Air 13-inch multi-function.,79.99,75.99,8696
OWC0008,OWC Data Doubler Optical Bay Adapter Mac Mini (2009) iMac (2009-11),Tray substitution of superdrive by hard drive 25 inches.,72.99,39.99,12755395
WAC0054,Wacom Bamboo Pen (pen parts for CTL-470K),Replacement pen for CTL-470K.,34.9,31.99,1229
WAC0055,Wacom Intuos Professional Accessory Kit,Intuos accessory kit.,24.9,22.99,101781405
MAK0015,Stick Maclocks silver metal safely iPad,Security lock plate steel iPad.,49.99,49.99,12085400
SEA0049,"Seagate Barracuda 1TB Hard Drive 35 ""SATA for Mac and PC",internal hard drive Mac and PC 1TB (ST1000DM010),59.0,41.2,12655397
PAC0185,"Apple MacBook Pro 133 ""i5 25GHz | RAM 16GB | 275GB SSD",Apple MacBook Pro 133 inches (MD101Y / A) with 275GB SSD.,1639.0,1469.0,1282
PAC1181,"Apple MacBook Pro 133 ""i5 25GHz | 16GB RAM | 1TB SSD",Apple MacBook Pro 133 inches (MD101Y / A) with extended RAM and SSD.,2159.0,1769.0,1282
PAC1240,"Apple MacBook Pro 133 ""i5 25GHz | RAM 16GB | 525GB SSD",Apple MacBook Pro 133 inches (MD101Y / A) with extended RAM and SSD.,1899.0,1575.59,1282
APP0490,Apple Airport Express,Airport Express base station 802.11a / b / g / n.,109.0,104.0,1334
APP0399,Apple Thunderbolt to Gigabit Ethernet Adapter Mac,Mac adapter Thunderbolt to Gigabit Ethernet (MD463ZM / A).,35.0,33.0,1325
KAN0009,Kanex ATV Pro HDMI to VGA adapter,HDMI to VGA adapter that supports audio.,59.95,39.99,1325
APP0400,Apple MagSafe to MagSafe converter 2,MagSafe to MagSafe converter 2.,12.0,12.0,1325
APP0407,Apple USB SuperDrive (June 2012 Model),New CD / DVD retina MacBook Pro MacBook Air iMac Mac Pro and Mac Mini.,89.0,87.25,1424
APP0408,Apple 45W MagSafe 2 charger MacBook Air,Charger MacBook Air MagSafe 2 of 45 W (MD592Z / A).,89.0,85.0,13005399
APP0409,Apple 85W MagSafe 2 charger MacBook Pro Retina screen 15 '',MagSafe charger 2 of 85 W (MD506Z / A).,89.0,85.0,13005399
DLK0008,D-Link DCS-932L Wireless IP Camera Cloud,Wireless network camera day and night home with my DLink.,79.99,48.99,9094
DLK0009,D-Link DCS-942L Wireless IP Camera Cloud,security camera with Wi-Fi or Ethernet night vision and motion sensor application for iPhone and iPad,169.99,86.99,9094
DLK0011,D-Link DUB-1340 Hub 4 x SuperSpeed ​​USB 3.0 Mac and PC,Dlink USB Hub Mac and PC 4 port.,64.0,46.99,12995397
DLK0012,D-Link DUB-H7 Hub 7 x Hi-Speed ​​USB Mac and PC,Dlink USB Hub Mac and PC 7 ports.,33.99,26.99,12995397
WDT0140,"Red 2TB WD 35 ""Mac PC hard drive and NAS",Western Digital hard drive designed for NAS 2TB (WD20EFRX).,99.0,80.59,12655397
WDT0141,"WD Red 3TB 35 ""Mac PC hard drive and NAS",Western Digital hard drive designed for NAS 3TB (WD30EFRX).,129.0,101.99,12655397
WDT0183,"Red 4TB WD 35 ""Mac PC hard drive and NAS",Western Digital hard drive designed for NAS 4TB (WD40EFRX).,169.0,125.99,12655397
WDT0249,"WD Red 6TB 35 ""Mac PC hard drive and NAS",Western Digital hard drive designed for NAS 6TB (WD60EFRX).,255.0,189.99,12655397
WDT0318,"WD Red 8TB 35 ""Mac PC hard drive and NAS",Western Digital Hard Drive 8TB 35 inch SATA 6 Gb / s for small businesses and home.,359.0,239.99,12655397
WDT0395,"WD Red 10TB 35 ""Mac PC hard drive and NAS",Western Digital Hard Drive 10TB 35-inch SATA 6 Gb / s for small businesses and home.,439.0,339.99,12655397
WAC0030,Wacom Cintiq 22HD Interactive Pen Display Mac and PC,LCD graphic display with 215-inch Full HD and pencil precision for Mac and PC,1799.0,1512.0,1405
NTE0044,"NewerTech windy 225 ""for iMac",Suction cup 225 inches for aluminum iMac.,11.99,11.99,14305406
OWC0020,Envoy OWC USB 3.0 Case for MacBook Air SSD 2010/2011,Box Portable External USB 2.0 / 3.0 for MacBook Air SSD.,60.99,41.99,11935397
NTE0012,NewerTech universal adapter IDE / SATA to USB 3.0,High speed universal adapter HDD / SSD to USB 3.0.,54.99,32.9,1325
NTE0013,"AdaptaDrive NewerTech adapter 2.5 ""to 3.5"" SATA",Adapter HDD / SSD 2.5 SATA 3.5 compatible with Mac Pro.,26.99,19.99,12755395
NTE0014,NewerTech eSATA to USB 3.0 Adapter,High-speed eSATA adapter to USB 3.0.,36.99,25.99,1325
OWC0024,OWC Mount Adapter 25-35 Pro Mac Pro (2009-2012),SSD hard drive adapter or 2.5 for Mac Pro.,35.99,25.99,12755395
NTE0015,NewerTech NuStand Support Mac Mini Silver Alloy,Elegant support for MacMini 2010 and later,30.99,19.99,8696
NTE0017,"NewerTech NuPower Battery MacBook 13 ""white",133 inch MacBook battery (White Model).,119.99,89.99,10142
NTE0018,"NewerTech NuPower Battery MacBook 13 ""Black",133 inch MacBook battery (Black Model).,119.99,89.99,10142
NTE0020,"NewerTech NuPower battery MacBook Pro 15 ""(Late 2008 - Early 2009)",Battery MacBook Pro 15-inch Unibody late 2008 and early 2009,119.99,94.99,10142
NTE0021,"NewerTech NuPower Battery MacBook 13 ""Aluminum",battery MacBook 13-inch (Aluminum Model).,119.99,99.99,10142
OWC0028,"OWC SSD installation Kit for iMac 215 ""(2011)",Installation kit for iMac SSD 215 inches (2011).,60.99,39.99,14305406
OWC0013,OWC Kit of 5 tools for Mac and PC,Kit of 5 tools for repair / extension Mac.,6.99,2.99,14305406
OWC0026,"Installation Kit OWC SSD Hard Drive 25 ""Mac mini 2011/2012",Installation Kit HDD or SSD for Mac mini 2011 Late 2012 Mid tools,54.99,39.99,14305406
OWC0027,"OWC SSD installation kit for iMac 27 ""2011",SSD installation on iMac 27-inch Mid 2011 Kit,60.99,42.99,14305406
OWC0029,"OWC SSD installation Kit for iMac 27 ""(2010)",Installation Kit SSD iMac 27-inch (model 2010).,60.99,39.99,14305406
NTE0010,NewerTech iPhone Kit tools,7 Kit tools needed for iPhone 4 / 4S,15.99,10.99,12645406
APP0410,Apple Thunderbolt to FireWire 800 adapter,Adapter Thunderbolt to Firewire 800 connection.,35.0,33.0,1325
STM0038,"STM Bags Small Alley Backpack MacBook Pro 13 ""black coal",Slingbag MacBook Pro 13-inch.,40.0,29.99,10230
NTE0022,"NewerTech NuPower battery MacBook Pro 17 ""(2006-2008)",MacBook Pro 17 inch battery.,145.99,109.99,10142
OWC0025,"SSD expansion kit OWC Aura Pro 6G 240GB MacBook Air 11 ""and 13"" 2012",SSD 240GB expansion for MacBook Air 11-inch and 13-inch 2012 Kit tools,241.99,199.58,12215397
NTE0023,NewerTech eSATA Cable Adapter Mac Pro,Add 2 eSATA ports with the adapter cable for Mac Pro.,30.99,7.39,12755395
OWC0009,OWC Case External SuperSlim for SuperDrive MacBook / MacBook Pro,Black External Case for Apple SuperDrive.,48.99,20.49,11935397
OWC0039,"OWC Mercury On-The-Go Pro Mini transparent box 25 ""FW800 / FW400 / USB3",outer case 25 inch SATA connection FW800 / FW400 / USB 3.0.,96.99,69.99,11935397
OWC0040,"OWC Mercury On-The-Go Pro Mini transparent box 25 ""USB3 / USB2",outer case 25 inch SATA USB 3.0 and 2.0.,54.99,32.99,11935397
OWC0228,OWC Tools MacBook Air 2010 and MacBook Pro Retina back and Torx5 & Torx Plus pentalobe,2 Kit tools for repair / expansion MacBook Air 2010 and MacBook Pro Retina and posterior (all models),15.99,15.99,14305406
OWC0015,"OWC Aura expansion kit 6G SSD 120GB MacBook Air 11 ""and 13"" 2010 to 2011",120GB SSD expansion for MacBook Air 11-inch and 13-inch Late 2010 to Mid 2011 Kit tools,144.99,131.58,12215397
MUV0042,Clear Back Case Muvit iPhone / 5s / 5 transparent,iPhone back cover tranparente SE / 5s / 5.,9.99,8.99,11865403
APP0434,Apple 5W USB power adapter iPhone and iPod,USB Power Adapter 5W 1A for iPhone iPod and Apple Watch.,25.0,24.0,14365395
APP0435,Apple Lightning to 30-pin adapter iPhone 5 / 5S iPad mini and iPod,Lightning connector adapter 30-pin iPhone 5 / 5S and 5G iPod Touch Nano 7G (02m).,45.0,41.0,14365395
APP0436,Apple Lightning adapter to 30-pin connector,Lightning adapter connector 30-pin iPhone 5 iPod Touch 5 iPod Nano 7.,35.0,33.0,14365395
APP0437,Apple EarPods headset with microphone connector Jack iPad and iPod,IPhone iPad and iPod headphones with microphone and remote.,35.0,33.0,5384
APP0438,Apple Lightning connector cable to USB 1m White,Lightning USB cable 1 meter to charge and sync iPhone iPad and iPod.,25.0,23.0,1230
OWC0041,Mac OWC Memory 4GB DDR3 1066MHZ SO-DIMM,4GB RAM Mac mini iMac MacBook and MacBook Pro (2008/10).,43.99,43.99,1364
OWC0042,Mac OWC Memory 4GB DDR3 1333MHZ SO-DIMM,4GB RAM Mac mini iMac (2010/11) and MacBook Pro (2010/11).,46.99,46.99,1364
OWC0043,Mac OWC Memory 8GB 1333MHZ DDR3 SO-DIMM,8GB RAM Mac mini iMac (2010/11) and MacBook Pro (2010/11).,99.99,99.99,1364
OWC0035-2,Mac memory OWC 8GB (2x4GB) SO-DIMM DDR3 1066MHZ,RAM 8GB (2x4GB) Mac mini iMac MacBook and MacBook Pro (2008/10).,87.98,86.99,1364
OWC0036-2,Mac memory OWC 8GB (2x4GB) SO-DIMM DDR3 1333MHZ,RAM 8GB (2x4GB) Mac mini (2011) iMac (2010-2011) MacBook Pro (2011).,93.98,92.99,1364
REP0060,iPhone 4s battery repair,It is including parts and labor for iPhone 4s,29.99,29.99,"1,44E+11"
REP0068,Headset calls iPhone 4s repair,Repair service including parts and labor for iPhone 4s,39.99,39.99,"1,44E+11"
SYN0063,Synology DX513 expansion NAS Mac and PC,Expansion unit 5 bays.,423.99,423.9,12175397
DLK0019,D-Link DES-1008D Switch 8 10 / 100Mbps unmanaged,Dlink Switch 8 Mac and PC ports.,15.99,11.99,1334
PAC0272,OWC Mercury On-The-Go Pro Mini 1TB Hard Drive Mac and PC,Pack outer case 25 inch connections FW800 / FW400 / USB3 + HDD 1TB.,159.98,122.59,11935397
KIN0074,Kingston DataTraveler SE9 8GB USB 2.0 key,8GB USB 2.0 key minimalist design.,4.99,5.78,57445397
KIN0072,Kingston DataTraveler SE9 16GB USB 2.0 key,16GB USB 2.0 key minimalist design.,7.0,6.28,57445397
KIN0073,Kingston DataTraveler SE9 32GB USB 2.0 key,32GB USB 2.0 key minimalist design.,14.99,14.28,57445397
MOS0078,Moshi iGlaze iPhone Case SE / 5s / 5 Black,rigid shell with silver rim iPhone SE / 5s / 5,30.0,20.99,11865403
MOS0080,Moshi iGlaze iPhone Case SE / 5s / 5 white,hard case for iPhone SE / 5s / 5,30.0,19.99,11865403
MOS0082,Moshi iGlaze XT iPhone Case SE / 5s / 5 transparent,Rigid shell snap on iPhone SE / 5s / 5.,30.0,19.99,11865403
APP0483,Apple Lightning to VGA Adapter,Lightning connector adapter to VGA.,59.0,55.0,1230
GRT0264,Griffin CinemaSeat Case for iPad mini / black Retina,IPad mini car cover neoprene support.,39.99,18.99,12635403
GRT0265,Griffin Survivor Case iPad mini 1/2/3 Black,IPad mini sleeve ultra-resistant for extreme conditions.,59.99,35.99,12635403
APP0464,Apple adapter 12 W USB iPhone iPod and iPad,USB Power Adapter 12 W for iPhone iPad and iPod.,25.0,24.0,5395
APP0474,"Apple 60W MagSafe 2 charger MacBook Pro Retina Display 13 """,MagSafe charger 2 of 60 W (MD565Z / A).,89.0,85.0,13005399
APP0481,Apple Lightning to USB adapter for cameras,Lightning connector adapter USB camera (MD821ZM / A).,35.0,33.0,5395
APP0482,Adapter Apple Lightning to SD Card Reader,Lightning connector adapter to SD card reader (MD822ZM / A).,35.0,33.0,5395
APP0484,Apple Digital AV Adapter to Lightning,Lightning adapter connector to digital AV (MD826ZM / A).,59.0,55.0,5395
OWC0045,Mac OWC Memory 4GB DDR3 1600MHZ SO-DIMM,4GB RAM MacBook Pro and Mac mini iMac (2012).,46.99,44.99,1364
OWC0039-2,Mac memory OWC 8GB (2x4GB) SO-DIMM DDR3 1600MHZ,RAM 8GB (2x4GB) MacBook Pro iMac Mac mini (2012) and iMac 5K Retina 27-inch (2014).,93.98,87.99,1364
NTE0025,NewerTech Voyager Q HDD Dock FW800 / 400 / USB3.0 / eSATA,Dock disc 25 inch and 35 inch FW800 / 400 / USB3.0 / eSATA.,108.99,62.69,12995397
NTE0026,NewerTech Voyager S3 Dock HDD USB3.0 / Sata,Dock disc 25 inches and 35 inches with USB3.0 / eSATA.,60.99,39.99,12995397
BEZ0157,"Be.ez LArobe Case for MacBook Pro Retina 15 ""gray / red",Retina MacBook Pro sleeve 15 inch polyurethane.,34.95,19.99,13835403
BEZ0158,"Be.ez LArobe Case for MacBook Pro Retina 15 ""gray / blue",Retina MacBook Pro sleeve 15 inch polyurethane.,34.99,28.99,13835403
OTR0062,StarTech USB adapter mini Bluetooth 2.1,Mini Bluetooth USB for Mac and PC wireless network.,24.99,24.99,1334
BEZ0159,"Be.ez LArobe Case for MacBook Pro Retina 15 ""gray / black",Retina MacBook Pro sleeve 15 inch polyurethane.,34.99,28.99,13835403
OWC0054,"OWC SSD installation Kit for iMac 27 ""(2010) without tools",SSD installation kit without tools iMac 27-inch (model 2010),35.99,19.99,12755395
OWC0052,"OWC SSD installation Kit for iMac 27 ""(2011) without tools",SSD installation kit without tools iMac 27-inch (model 2011).,35.99,19.99,12755395
OTR0039,Startech Splitter Adapter 2 headphones,headphone jack adapter 2 Mini-3-pin mini-jack to 4 pin.,9.2,7.99,1230
SPE0072,"Speck SeeThru Case Macbook Air 13 ""Blue",Housings MacBook Air 13 inches.,49.9,39.99,13835403
NTE0027,NewerTech Mini DVI to DVI Adapter,Adapter mini DVI to DVI.,18.99,10.99,1325
NTE0028,NewerTech Mini DVI to VGA Adapter,Mini DVI to VGA.,18.99,12.99,1325
NTE0029,NewerTech Mini DVI to HDMI Adapter,Mini DVI to HDMI.,21.99,15.99,1325
NTE0030,NewerTech Mini DisplayPort to VGA Adapter,Adapter Mini Display Port to VGA.,33.99,22.99,1325
NTE0031,NewerTech Adapter Mini Display Port to DVI,Adapter mini Display Port to DVI.,29.99,14.99,1325
NTE0032,NewerTech MiniDisplay Port to HDMI Adapter,Adapter mini Display Port to HDMI.,29.99,14.99,1325
NTE0034,NewerTech NuTouch Gloves Gloves iPhone iPad and iPod Gray (Size S),Small size gloves for iPhone iPad and iPod.,23.99,14.99,11905404
NTE0037,NewerTech NuTouch Gloves Gloves iPhone iPad and iPod Gray (Size XL),Gloves size XL for iPhone iPad and iPod.,23.99,16.99,11905404
OWC0055,"Installation Kit OWC SSD / HDD 25 ""Mac mini (2011/2012)",Installation Kit SSD / Hard for Mac mini (2011-2012) Disco.,42.99,29.99,12755395
SPE0066,"Speck SeeThru Satin MacBook Pro Retina Case 15 ""Black",Housing MacBook Pro with Retina display 15-inch (June 2012).,49.9,39.99,13835403
OWC0044,"SSD expansion kit OWC Aura Pro 6G 480GB MacBook Air 11 ""and 13"" 2010 to 2011",480GB SSD expansion for MacBook Air 11-inch and 13-inch Late 2010 to Mid 2011 Kit tools,386.99,319.58,12215397
MOS0085,Moshi iVisor XT protector iPhone / 5s / 5 white,IPhone Protector SE / 5s / 5 anti glare.,24.95,14.99,13555403
MOS0086,Moshi iVisor XT protector iPhone / 5s / 5c / 5 black,IPhone Protector SE / 5s / 5 anti glare.,24.95,14.99,13555403
OWC0053,"OWC SSD installation Kit for iMac 215 ""(2011) without tools",Kit installation without tools iMac SSD 215 inches (models 2011).,35.99,21.99,12755395
OWC0037-2,Mac OWC memory 16GB (2x8GB) SO-DIMM DDR3 1333MHZ,2x8GB RAM iMac (2010/2011) Mac mini (2011) and MacBook Pro (2011),199.98,197.99,1364
OWC0046,Mac OWC Memory 8GB 1600MHZ DDR3 SO-DIMM,8GB RAM MacBook Pro iMac Mac mini (2012) and iMac 5K Retina 27-inch (2014).,92.99,92.99,1364
OWC0040-2,Mac OWC memory 16GB (2x8GB) SO-DIMM DDR3 1600MHZ,RAM 16GB (2x8GB) MacBook Pro iMac and Mac mini (2012).,185.98,183.99,1364
OWC0057,Mac OWC Memory 8GB (2x4GB) 667MHz DDR2 FB-DIMM,RAM 8GB (2x4GB) for Mac Pro.,106.99,84.99,1364
OWC0058,Mac OWC Memory 4GB (2x2GB) 800MHz DDR2 FB-DIMM,RAM 4GB (2x2GB) for Mac Pro 8-core.,96.99,72.99,1364
OWC0059,Mac OWC Memory 8GB (2x4GB) 800MHz DDR2 FB-DIMM,RAM 8GB (2x4GB) for Mac Pro 8-core.,169.99,114.99,1364
NTE0019,"NewerTech NuPower battery MacBook Pro 15 ""unibody no (2006-2008)",Battery MacBook Pro 15-inch Unibody No 2006-2008,119.99,94.99,10142
PIE0007,Internal Battery for iPhone 4,Replacement AC Adapter for Apple iPhone 4.,14.95,14.99,21485407
PIE0009,Internal Battery for iPhone 4S,Replacement AC Adapter for Apple iPhone 4S.,14.99,14.99,21485407
PIE0011,Internal Battery for iPhone 3G,Replacement AC Adapter for Apple iPhone 3G.,9.9,9.9,21485407
OWC0060,Mac OWC Memory 2GB 667MHz DDR2 SO-DIMM,2GB RAM Mac mini and iMac (2006/07) MacBook Pro (2006/07/08).,23.99,20.99,1364
OWC0054-2,Mac OWC memory 4GB (2x2GB) 667MHz DDR2 SO-DIMM,RAM 4GB (2x2GB) Mac mini and iMac (2006/07) MacBook Pro (2006/07/08).,47.98,41.99,1364
OWC0054-3,Mac OWC 6GB memory (2GB 4GB +) DDR2 667MHz SO-DIMM,6GB RAM (4GB + 2GB) Mac mini and iMac (2006/07) MacBook Pro (2006/07/08).,138.98,132.99,1364
OWC0061,Mac OWC Memory 4GB 667MHz DDR2 SO-DIMM,4GB RAM Mac mini and iMac (2006/07) and MacBook Pro (2006/07/08).,114.99,113.99,1364
OWC0062,Mac OWC Memory 1GB 667MHz DDR2 SO-DIMM,1GB RAM Mac mini and iMac (2006/07) MacBook Pro (2006/07/08).,12.99,9.99,1364
OWC0056-2,Mac OWC 2GB memory (2x1GB) 667MHz DDR2 SO-DIMM,RAM 2GB (2x1GB) Mac mini and iMac (2006/07) MacBook Pro (2006/07/08).,25.98,19.99,1364
OWC0063,Mac OWC Memory 2GB 800MHz DDR2 SO-DIMM,RAM 2GB iMac (2008) and MacBook (2009).,23.99,20.99,1364
OWC0057-2,Mac OWC memory 4GB (2x2GB) SO-DIMM DDR2 800MHz,RAM 4GB (2x2GB) iMac (2008) and MacBook (2009).,47.98,41.99,1364
OWC0064,Mac OWC Memory 4GB 800MHz DDR2 SO-DIMM,4GB RAM iMac (2008) and MacBook (2009).,123.99,119.99,1364
OWC0218,"SSD expansion kit OWC Aura Pro 6G 120GB MacBook Air 11 ""and 13"" 2012",120GB SSD expansion for MacBook Air 11-inch and 13-inch 2012 with Tools Kit,151.0,131.58,12215397
OWC0022,"SSD expansion kit OWC Aura Pro 6G 480GB MacBook Air 2012 11 ""and 13""",480GB SSD expansion for Mid 2012 MacBook Air 11-inch and 13-inch tool kit,379.99,300.58,12215397
OWC0065,"SSD expansion kit OWC Aura Pro 6G 480GB MacBook Pro Retina 13 ""and 15"" from 2012 to 2013",expansion of 480GB SSD for MacBook Pro Retina 13-inch Late 2012 and Early 2013 MacBook Pro Retina 15-inch Early 2013 Mid 2012 Kit tools,411.99,346.58,12215397
OWC0066,"SSD expansion kit OWC Aura Pro 6G 240GB MacBook Pro Retina 13 ""and 15"" from 2012 to 2013",240GB SSD expansion MacBook Pro Retina 13-inch Late 2012 and Early 2013 MacBook Pro Retina 15-inch Mid 2012 / Early 2013 Tool Kit,229.99,199.99,12215397
DRO0015,Drobo 5D USB 3.0 Thunderbolt Mac and PC RAID System,Mac and PC RAID 5-bay Thunderbolt USB 3.0.,749.0,658.99,11935397
NTE0056,NewerTech Complete set of 14 tools,portable kit of 14 tools for Mac and PC.,23.99,19.99,14305406
KEN0078,Kensington Easy Riser Notebook PC and Mac,Support for Mac portable and adjustable PC.,24.99,22.9,8696
KEN0079,Kensington Expert Presenter Green Laser Pointer,laser pointer 10X bright green.,76.99,59.99,1229
TOS0007,"Toshiba 1TB 25 ""SATA 5400rpm hard drive Mac and PC",internal hard drive Mac and PC 1TB and 95 mm (MQ01ABD100).,62.99,51.99,12655397
KEN0080,Kensington Presenter Expert green laser pointer with 4GB,laser pointer green + USB 4GB 10 times brighter,89.99,74.99,1229
KEN0081,Kensington Expert Presenter Red Laser Pointer,Red laser pointer for presentations color.,49.99,44.99,1229
TWS0041,Twelve South HiRise iMac and Cinema Display Support,adjustable and adjustable stand with drawer for iMac and Apple Cinema Display.,89.99,76.99,8696
TWS0096,Twelve South HiRise Support MacBook Pro / Air,adjustable bracket with silicone arms Macbook Pro / Air.,79.99,69.99,8696
APP0498,Apple Lightning connector cable to USB 50cm,Lightning to USB Cable for iPhone 5 iPad mini iPad 4 / Air iPod Touch 5 iPod Nano 7.,25.0,23.0,1230
TUC0084,"Dritta case Tucano MacBook Pro 15 ""Retina Black",comfortable briefcase / shoulder bag compatible with MacBook Pro 15-inch Retina and iPads,29.99,26.9,10230
SPE0087,IGuy Speck Case iPad mini / green Retina,Funda iPad mini ideal for children.,34.99,25.99,12635403
SEV0007,RAM installation service MacBook / Pro,Installation of RAM in your MacBook / Pro.,19.99,19.99,20642062
SEV0012,HDD or SSD installation service MacBook / Pro,HDD or SSD installation on your MacBook / Pro + Data Transfer.,49.99,49.99,20642062
SEV0026,Service installation RAM + HDD + SSD MacBook / Pro,RAM + HDD installation + SSD in your MacBook / Pro + Data Transfer.,59.99,59.99,20642062
SEV0018,IMac RAM installation service,Installation of RAM in your iMac.,19.99,19.99,20642062
SEV0019,Installation Service Mac mini RAM,RAM installed in your Mac mini.,19.99,19.99,20642062
SEV0021,SSD installation service MacBook Pro Retina,Installing SSD in your MacBook Pro Retina + Data Transfer.,49.99,49.99,20642062
SEV0022,MacBook Air SSD installation service,SSD installation on your MacBook Air + Data Transfer.,49.99,49.99,20642062
