sku,name,desc,price,promo_price,type
PAC2154,Apple Mac Pro 8-core 3GHz | 32GB RAM | 1TB PCIe SSD,Apple Mac Pro 8-core 3GHz 32GB RAM 1TB PCIe Flash,5849.0,5393.0,21632158
PAC2159,Apple Mac Pro 12-core 27GHz | 64GB RAM | 1TB PCIe SSD,Apple Mac Pro 12-Core 27GHz 64GB RAM 1TB PCIe SSD,8249.0,7232.0,21632158
PAC1941,Apple Mac Pro 35GHz 6 cores | 32GB RAM | 256GB PCIe SSD,New Mac Pro with 32GB RAM and two 6-core GPU 35GHz AMD FirePro D500 (MD878Y / A),3935.59,3599.0,21632158
APP2018,Apple Mac Pro 35GHz 6 cores | 16GB RAM | 256GB PCIe SSD,New Mac Pro with 16GB of RAM and two 6-core GPU 35GHz AMD FirePro D500 (MD878Y / A),3455.59,3199.0,21632158
APP2019,Apple Mac Pro 35GHz 6 cores | 16GB RAM | 256GB PCIe SSD | åÊFirePro D700 6GB,New Mac Pro with 16GB of RAM and two 6-core GPU 35GHz AMD FirePro D700 (MD878Y / A),3689.0,3431.0,21632158
PAC1945,Apple Mac Pro 35GHz 6 cores | 32GB RAM | 512GB PCIe SSD,New Mac Pro with 32GB RAM and two 6-core GPU 35GHz AMD FirePro D500 (MD878Y / A),4169.0,3831.0,21632158
PAC1946,Apple Mac Pro 35GHz 6 cores | 64GB RAM | 512GB PCIe SSD,New Mac Pro with 64GB of RAM and two 6-core GPU 35GHz AMD FirePro D500 (MD878Y / A),5129.0,4331.0,21632158
APP2021,Apple Mac Pro 35GHz 6 cores | 16GB RAM | 1TB PCIe SSD,New Mac Pro with 16GB of RAM and two 6-core GPU 35GHz AMD FirePro D500 (MD878Y / A),4169.0,3877.0,21632158
PAC1947,Apple Mac Pro 35GHz 6 cores | 32GB RAM | 1TB PCIe SSD,New Mac Pro with 32GB RAM and two 6-core GPU 35GHz AMD FirePro D500 (MD878Y / A),4649.0,4277.0,21632158
PAC1948,Apple Mac Pro 35GHz 6 cores | 64GB RAM | 1TB PCIe SSD,New Mac Pro with 64GB of RAM and two 6-core GPU 35GHz AMD FirePro D500 (MD878Y / A),5609.0,4777.0,21632158
APP2022,Apple Mac Pro 35GHz 6 cores | 16GB RAM | 512GB PCIe SSD | FirePro D700 6GB,New Mac Pro with 16GB of RAM and two 6-core GPU 35GHz AMD FirePro D700 (MD878Y / A),3929.0,3654.0,21632158
PAC1949,Apple Mac Pro 35GHz 6 cores | 32GB RAM | 512GB PCIe SSD | FirePro D700 6GB,New Mac Pro with 32GB RAM and two 6-core GPU 35GHz AMD FirePro D700 (MD878Y / A),4409.0,4054.0,21632158
PAC1950,Apple Mac Pro 35GHz 6 cores | 64GB RAM | 512GB PCIe SSD | FirePro D700 6GB,New Mac Pro with 64GB of RAM and two 6-core GPU 35GHz AMD FirePro D700 (MD878Y / A),5369.0,4554.0,21632158
SNN0062,Sonnet eGFX Breakaway Box 550W PCIe Thunderbolt Expansion Box 3,Expansion box for graphics cards and PCIe cards with 550W power,422.29,371.99,12995397
ELG0050,Eve Elgato Degree temperature sensor,Monitor humidity sensor temperature and pressure with LCD screen supports homekit for iPhone iPad and iPod,69.99,64.99,11905404
SNN0066,Sonnet Echo Express III-D Box PCIe Thunderbolt 3,Thunderbolt expansion box 3 for PCIe cards with 3 slots,1087.79,1059.99,12995397
APP2182,Apple Pencil Case Blue Night,Carrying case with leather material for Apple Pencil,35.0,35.0,5403
APP2183,Apple Pencil Case Black,Carrying case with leather material for Apple Pencil,35.0,35.0,5403
APP2166,"Apple iPad Leather Smart Cover Case Pro ""Brown Taupe 10.5",Intelligent quality leather case with function on / off 105-inch iPad Pro,85.0,79.0,12635403
APP2167,"Apple iPad Leather Smart Cover Case Pro ""Candy Brown 10.5",Intelligent quality leather case with function on / off 105-inch iPad Pro,85.0,79.0,12635403
APP2171,"Apple iPad Leather Smart Cover Case Pro 12.9 ""Blue Night",Intelligent quality leather case with function on / off 129-inch iPad Pro,95.0,89.0,12635403
APP2174,"Apple iPad Smart Cover Case Pro 10.5 ""Blue Night",Smart case with function on / off and adjust to different positions for cases Pro 105 inches,59.0,56.0,12635403
APP2175,"Apple iPad Smart Cover Case Pro 10.5 ""Rosa Arena",Smart case with function on / off and adjust to different positions for cases Pro 105 inches,59.0,56.0,12635403
APP2160,"Apple iPad Smart Cover Case Pro 10.5 ""White",Smart case with function on / off and adjust to different positions for cases Pro 105 inches,59.0,56.0,12635403
APP2184,"Apple iPad Smart Cover Case Pro 10.5 ""Blue Haze",Smart case with function on / off and adjust to different positions for cases Pro 105 inches,59.0,56.0,12635403
APP2185,"Apple iPad Smart Cover Case Pro 10.5 ""Pink Flamingo",smart cover with function on / off and adjust to different positions for iPad Pro 105,59.0,56.0,12635403
APP2176,"Apple iPad Smart Cover Case Pro 12.9 ""Charcoal Gray",Smart case with function on / off and adjust to different positions for cases Pro 129 inches,69.0,65.0,12635403
APP2177,"Apple iPad Smart Cover Case Pro 12.9 ""White",Smart case with function on / off and adjust to different positions for cases Pro 129 inches,69.0,36.99,12635403
APP2164,"Apple iPad Leather Sleeve Case Pro 10.5 ""Blue Night",Leather case with full protection and slot Pencil Apple iPad Pro 105 inches,149.0,142.0,12635403
APP2165,"Apple iPad Leather Sleeve Case Pro 10.5 ""Black",Apple Leather Case with full protection and slot Pencil Apple iPad Pro 105 inches,149.0,142.0,12635403
APP2179,"Apple iPad Leather Sleeve Case Pro 12.9 ""Blue Night",Apple Leather Case with full protection and slot Pencil Apple iPad Pro 129 inches,169.0,159.0,12635403
APP2180,"Apple iPad Leather Sleeve Case Pro 12.9 ""Black",Apple Leather Case with full protection and slot Pencil Apple iPad Pro 129 inches,169.0,159.0,12635403
APP2161,"Smart Apple iPad Keyboard Case Keyboard Pro 10.5 """,Cover with keyboard shortcuts and Spanish (direct connection) for iPad Pro 105,179.0,179.0,12635403
APP1977-A,Open - Apple iPad Wi-Fi + Cellular 128GB Gold,iPad Wi-Fi + Cellular 128GB Gold Reconditioned,659.0,616.22,1298
APP1962-A,Like new - Apple iPhone 32GB Gold,SE iPhone with 4-inch screen 32 free GB. As new open box,419.0,359.0,1298
WAC0213-A,Open - Wacom MobileStudio Pro 16 i7 512GB,Professional graphics tablet with 16-inch i7 and 512GB and Pen stylus Pro 2 for Mac and PC,3199.9,2770.39,1298
APP1626-A,Open - Apple iPhone 7 Plus 128GB Gold,Apple iPhone 7 Plus 128GB free gold. As a new open box,889.0,844.16,85651716
TOS0014-A,Open - Toshiba Canvio Basic 2TB External Hard Drive USB 3.0 Black,25-inch External Hard Drive 2TB USB 3.0 for Mac and PC.,88.0,83.79,1298
APP1575-A,"Open - Apple MacBook Air 13 ""i5 16 Ghz | 8GB RAM | 128GB Flash",Laptop MacBook Air 13 inch i5 128GB RAM 8GB Flash 16GHz. New - Open Box,1099.0,914.69,1298
THU0039-A,Open - Thule Atmos X3 Case Black iPhone 7,resistant sheath with adhesive inner material and volume buttons metal bezel iPhone high 7,29.95,20.29,1298
APP0660-A,"Open - AppleCare Protection MacBook Pro 15 """,Apple Care extended warranty MacBook Pro 15-inch and 15-inch MacBook Pro Retina,349.0,253.11,1298
STA0020-A,Open - Startech Adapter Lightning to Micro USB-B Female White,Lightning to Micro USB Adapter for iPhone-B generation iPad and iPod Touch 6A.,16.99,11.02,1298
SEA0106-A,Open - Seagate Innov8 8 TB External Hard Drive USB-C,Robust external hard drive with USB connection 8TB-C USB power cable for Mac,399.0,355.84,1298
SEA0104-A,Open - Seagate 4TB HDD Nas IronWolf Sata 3,NAS hard drive designed for systems with interface SATA 6Gb / s and rotation speed 5900Rpm for Mac and PC,179.99,116.22,12655397
CRU0015-2-A,Open - Crucial Mac Memory 16GB (2x8GB) DDR3 1600MHZ SO-DIMM,RAM 16GB (2x8GB) 135V MacBook Pro iMac (2012/2013) and Mac mini (2011/12).,149.98,148.99,1298
SAM0109-A,Open - Samsung EVO SSD 750 500 GB,SSD Hard Drive SATA 6 Gb / s 25-inch NAND technology for Mac and PC.,149.99,144.6,1298
GRT0416-A,"Open - Griffin Survivor All-Terrain resistant Case iPad Air 2 iPad Pro 97 ""Black / Gray",Protective Case for iPad Air 2 and iPad Pro 97,88.95,38.69,1298
HTE0004-A,Open - Hyper BOBO VR Virtual Reality Glasses White Z4,Virtual reality goggles helmets volume settings button to set the compatible screen with all models of iPhone,49.95,36.81,1298
NOM0018-A,Open - Nomad Horween Leather Strap Leather strap 42mm Apple Watch Brown / Black,Brown leather strap with buckle black for Apple Watch 42mm,69.99,56.99,1298
HOC0003-A,Open - Nike Hoco Series Apple Watch Strap 38mm Black / Yellow,Reconditioned sports silicone strap 38mm Apple Watch,45.0,17.97,2449
MOS0076-A,Open - Moshi iGlaze XT iPhone Case SE / 5s / 5 transparent,Rigid shell snap on iPhone SE / 5s / 5.,30.0,18.0,1298
IKM0056-A,Open - IK Multimedia iRig Guitar Interface 96kHz HD 2,Guitar interface for recording high quality audio 24bit / 96kHz compatible headphone amplifier port and Mac iPad iPhone (MFi),121.99,79.99,1298
LAC0153-A,Open - LaCie Porsche Design Desktop Drive External Hard Drive USB 3.0 5TB,External Hard Drive 5TB 35-inch USB 3.0 for Mac and PC.,174.99,144.79,1298
LAC0165-A,Open - LaCie Porsche Design Desktop Drive 8TB External Hard Drive USB 3.0,External Hard Drive 8TB 35-inch USB 3.0 for Mac and PC.,279.99,237.39,1298
LAC0182-A,Open - LaCie Porsche Design Hard Drive 4TB USB-C and USB 3.0,Refurbished desktop hard drive with 4TB USB-C adapter cable connection for Mac and PC,179.99,148.03,11935397
LIF0110-A,Open - LifeProof Fre Submersible iPhone Case 7 Blue,Case submersible in water and resistant to extreme conditions for iPhone 7,79.99,31.29,1298
MAT0001-A,Open - Matias Bluetooth keyboard Aluminum + Spanish number IOS and Mac Plata,Aluminum Bluetooth keypad manages 4 devices simultaneously for PC and Mac iPad iPhone,119.99,60.29,1298
KIN0166,Mac Memory Kingston 4GB DDR4 2400MHz SO-DIMM,Mac memory Kingston 4GB SO-DIMM 2400MHz DDR4 iMac 5K Retina 27 inches (Mid 2017).,54.99,46.99,1364
KIN0167,Mac Memory Kingston 8GB DDR4 2400MHz SO-DIMM,Mac memory Kingston 8GB SO-DIMM 2400MHz DDR4 iMac 5K Retina 27 inches (Mid 2017).,99.99,91.99,1364
KIN0168,Mac Memory Kingston 16GB DDR4 2400MHz SO-DIMM,Mac memory Kingston 16GB 2400MHz DDR4 SO-DIMM 27 inch iMac Retina 5K (Mid 2017).,189.99,169.99,1364
TPL0041,TP-Link RE305 coverage Extender - repeater Wi-Fi AC1200,Network Extender AC Wi-Fi dual-band Ethernet port,49.99,44.99,1334
APP1372-A,"Like new - Apple iMac 27 ""Core i7 Retina 5K 4GHz | 8GB | 256GB Flash",IMac desktop computer 27 inch Retina 5K RAM 256GB 8GB Flash,2929.0,2789.58,"5,74E+15"
BNQ0059,"PD2710QC BenQ Monitor 27 ""QHD Design Professional USB-C",27-inch monitor with 100% sRGB-C USB connection adjustable in height and tiltable through 90 degrees for Mac and PC.,575.0,575.0,1296
KAN0059,Kanex HDMI to VGA Adapter with Audio Support for Apple TV,HDMI to VGA adapter for Apple TV,49.55,45.99,5395
BNQ0055,"PD3200Q Monitor BenQ 32 ""LCD WQHD Professional design",Monitor 32 inch 100% sRGB height adjustable and tiltable through 90 degrees for Mac and PC.,466.0,466.0,1296
BNQ0056,"PD3200U Monitor Benq 32 ""4K UHD professional design",32 inch monitor with 100% sRGB 4K height adjustable and tiltable through 90 degrees for Mac and PC.,773.0,773.0,1296
LGE0060,"LG 27MP59G-P Monitor 27 ""FHD 1ms HDMI DisplayPort",27-inch monitor with 1ms response time HDMI and Display Port connection sRGB 99% for Mac and PC,249.0,229.99,1296
LGE0062,"LG 34UM69G-B Monitor 34 ""QHD 1ms sRGB USB-C 99% MaxxAudio DisplayPort",ultrapanorámico Monitor 34-inch QHD resolution USB-C connection 2 HDMI with speakers for Mac and PC,449.0,417.0,1296
LMP0026,Mini Dock USB Hub LMP-C + 8 ports Plata,Mini USB Hub-C-C to USB 3 x USB 3.0 HDMI with Ethernet SD and MicroSD compact and lightweight design for Mac and PC,89.0,79.99,12585395
LMP0027,Mini Dock USB Hub LMP-C + 8 ports Gray Space,USB Hub-C to USB-C 3 USB 3.0 HDMI with Ethernet SD and MicroSD compact and lightweight design for Mac and PC,89.0,79.99,12585395
LMP0028,Combo USB Hub LMP-C + 4 Port Plata,USB-C adapter USB 3.0 HDMI and USB-C (charging port) with compact design for Mac and PC,59.0,56.99,12585395
LMP0029,Combo USB Hub LMP-C + 4 Port Gray Space,USB-C adapter USB 3.0 HDMI and USB-C (charging port) with compact design for Mac and PC,59.0,56.99,12585395
QNA0228,QNAP QM2-2P PCIe expansion card dual M.2 SSD,PCIe expansion card to connect two M.2 SSD,136.23,135.99,1404
BEL0102-A,Open - Belkin 3 Cases iPhone Screen antihuellas SE / 5s / 5c / 5,Set of 3 Screen Protectors for iPhone SE / 5s / 5,12.99,7.51,1298
QNA0230,QNAP QM2-2P10G1T PCIe expansion card dual 10GbE M.2 SSD,PCIe expansion card to connect two M.2 SSD 10Gb Ethernet port,258.69,257.99,1404
QNA0197-A,Open - QNAP TS-431P NAS,4-bay NAS Server with 2 LAN ports and a powerful processor for home and small business Mac and PC,301.99,225.13,1298
PAC2176,Pack QNAP TS-251A NAS Server | 4GB RAM | WD 8TB Network,NAS with 4GB of RAM and two hard drives 4TB (2x4TB) WD Network for Mac and PC,736.09,597.18,12175397
PAC2168,QNAP TS-251A-4G NAS Server | 4GB RAM | 4TB (2x2TB) Seagate Iron Wolf,NAS with 4GB of RAM and two hard disks 2TB (2x2TB) Seagate IronWolf for Mac and PC,618.07,498.18,12175397
PAC2170,QNAP TS-251A-4G NAS Server | 4GB RAM | 8TB (2x4TB) Seagate Iron Wolf,NAS with 4GB of RAM and 8 TB capacity (2x4TB) with disks Seagate IronWolf for Mac and PC,758.07,571.18,12175397
PAC2174,QNAP TS-251A-4G NAS Server | 4GB RAM | 4TB (2x2TB) WD Red,NAS with 4GB of RAM and two hard disks 2TB (2x2TB) WD Network for Mac and PC,596.09,506.18,12175397
PAC2175,Pack QNAP TS-251A NAS Server | 4GB RAM | WD 6TB Network,NAS with 4GB of RAM and two hard disks 3TB (2x3TB) WD Network for Mac and PC,656.09,549.18,12175397
PAC2177,Pack QNAP TS-251A NAS Server | 4GB RAM | 12TB WD Red,NAS with 4GB of RAM and two hard disks 6TB (2x6TB) WD Network for Mac and PC,908.09,725.18,12175397
BOS0055,Bose SoundLink Bluetooth Speaker Black Color II,portable speaker with Bluetooth connection waterproof compact and multifunctional controls for iPhone iPad and iPod,139.0,122.99,5398
BOS0056,Bose SoundLink Color II Bluetooth Speaker White,portable speaker with Bluetooth connection waterproof compact and multifunctional controls for iPhone iPad and iPod,139.0,122.99,5398
BOS0057,Bose SoundLink Color II Bluetooth Speaker Red,portable speaker with Bluetooth connection waterproof compact and multifunctional controls for iPhone iPad and iPod,139.0,122.99,5398
BOS0058,Bose SoundLink Bluetooth Speaker Blue Color II,portable speaker with Bluetooth connection waterproof compact and multifunctional controls for iPhone iPad and iPod,139.0,122.99,5398
QNA0226,QNAP TS-251A NAS 4GB RAM,NAS with 4GB of RAM and USB port for direct access to Mac and PC,398.09,344.99,12175397
PAC1702,Pack QNAP TS-251A NAS Server | 16GB RAM | 8TB (2x4TB) WD Red,NAS with 16GB RAM and 8TB (2x4TB) WD Red for Mac and PC,889.67,737.18,12175397
KEN0249,Kensington Security Locking Station 2.0 Adapter MacBook,Adapter anchoring safety key and compact design for MacBook model 11 inches to 15 inches,120.01,114.99,12355400
TUC0317,"Tucano iPad Case Filo Minerale 105 ""Oro",Resistant cover front cover with magnetic closure and satin finish inch iPad Pro 105,39.9,29.99,12635403
TUC0319,"Tucano iPad Case Filo Minerale 105 ""Space Gray",Resistant cover front cover with magnetic closure and satin finish inch iPad Pro 105,39.9,32.99,12635403
TUC0321,"Cosmo Tucano iPad Case Pro 105 ""Blue",Leather with trunnion up to 360 degrees to 105 inches cases Pro,39.9,32.99,12635403
TAD0007,Tado Smart Climate Control Intelligent AC,intelligent control air conditioning works with iOS app supports,179.0,149.0,11905404
TAD0008,Tado thermostat Intelligent Bridge + Starter Kit supports HomeKit,Smart + bridge thermostat with LED screen app compatible with iOS and Homekit,179.99,179.99,11905404
OWC0231,OWC USB Dock-C 10-port power 80W Rose Gold,Aluminum Hub with 10 different ports include 2 USB-C ports and 0.5m cable for Mac and PC,217.99,179.99,12995397
OWC0232,OWC USB Dock-C 10-port power 80W Gray Space,Aluminum Hub with 10 different ports include 2 USB-C ports and 0.5m cable for Mac and PC,217.99,179.99,12995397
OWC0233,OWC USB Dock-C 10-port power 80W Plata,Aluminum Hub with 10 different ports include 2 USB-C ports and 0.5m cable for Mac and PC,217.99,173.99,12995397
TAD0009,Tado Intelligent Thermostatic head supports HomeKit,Temperature controller heating radiator compatible with intelligent system Tado,79.99,79.99,11905404
AP20221,Like new - Apple Watch Nike + 42mm Aluminum Case and Space Gray Nike Sport Strap Black / Volt,Apple Watch 42 mm refitted with double waterproof GPS processor core and belt 50mts exclusive Nike +,469.0,299.0,24895185
TUC0322,"Cosmo Tucano iPad Case Pro 105 ""Black",Leather with trunnion up to 360 degrees to 105 inches cases Pro,39.9,32.99,12635403
TUC0323,"Cosmo Tucano iPad Case Pro 105 ""Red",Leather with trunnion up to 360 degrees to 105 inches cases Pro,39.9,32.99,12635403
IOT0026,Mini Migo iOttie Palo selfie Black,Selfie stick with Bluetooth 3.0 extensible and egonómico light design with safety strap for iPhone,34.95,25.99,11905404
DLK0139,D-link Omna 180 HD Cam Video surveillance camera 180 degrees FHD Home Kit,Full HD video surveillance camera with 180 degrees and night vision compatible HomeKit,179.99,179.99,9094
AP20198,Like new - Apple Siri Remote,Remote refitted to the Media Player Apple Apple TV.,89.0,39.99,54864259
AP20199,Like new - Apple Smart Battery Battery Case iPhone 6s Charcoal Gray,Reconditioned Battery Case for iPhone 6s and 6,119.0,79.99,"5,49E+11"
AP20200,Like new - Apple Leather Case Cover iPhone 6 Plus / 6s Plus Black,Reconditioned ultrathin leather case and microfiber premium for iPhone 6 Plus / 6s Plus.,59.0,36.99,11865403
AP20201,Like new - Apple Case iPhone 6 Plus / 6s Plus Silicone Case White,Reconditioned ultrathin silicone cover and microfiber premium for iPhone 6 Plus / 6s Plus.,45.0,26.99,11865403
AP20202,Like new - Apple Leather Case Cover iPhone 6 / 6s Blue Night,Reconditioned ultrathin leather case and microfiber premium for iPhone 6 / 6S,55.0,36.99,11865403
AP20206,Like new - Apple iPhone Silicone Case Cover 7 Red Plus,Reconditioned ultrathin silicone case and microfiber premium for iPhone 7 Plus,45.0,29.99,11865403
AP20207,Like new - Apple Leather Case 7 Brown Candy iPhone Case,Reconditioned ultrathin leather case and microfiber premium for iPhone 7,55.0,36.99,11865403
AP20209,Like new - Apple Leather Case Cover Black iPhone 7 Plus,Reconditioned ultrathin leather case and microfiber premium for iPhone 7 Plus,59.0,39.99,11865403
AP20215,Like new - magnetic charging cable for Apple Watch (2m),Magnetic charging cable for Apple Watch reconditioned,45.0,34.99,1298
AP20218,Like new - Apple Leather Strap 42mm Loop Midnight Blue Size M,Leather strap with grainy texture for Apple Watch 42 mm,159.0,99.0,1298
LAC0234,LaCie Porsche Design Hard Drive 6TB USB-C and USB 3.0,Desktop Hard Drive 6TB USB-C adapter cable connection for Mac and PC,249.99,202.99,11935397
BOS0059,Bose SoundLink Bluetooth Speaker Revolve Gray,Bluetooth connection Sound speaker 360 degrees water resistant 12h battery for iPhone iPad and iPod,229.0,199.99,5398
BOS0052,Bose SoundLink Bluetooth Speaker Black Revolve,Bluetooth connection Sound speaker 360 degrees water resistant 12h battery for iPhone iPad and iPod,229.0,199.99,5398
BOS0053,Bose SoundLink Bluetooth Revolve + Black Speaker,Bluetooth connection Sound Speaker 360 degree waterproof 16h with battery handle for iPhone iPad and iPod,329.0,285.99,5398
BOS0054,Bose SoundLink Bluetooth Speaker Revolve + Gray,Bluetooth connection Sound Speaker 360 degree waterproof 16h with battery handle for iPhone iPad and iPod,329.0,285.99,5398
TWS0117,Twelve South BookBook iPhone Case 7 Brown Plus,Cover with vintage design book store card slot front cover and support for iPhone 7 Plus,59.99,59.99,11865403
TWS0118,Twelve South BookBook Case Black iPhone 7 Plus,Cover with vintage design book store card slot front cover and support for iPhone 7 Plus,59.99,59.99,11865403
TWS0115,Twelve South BookBook iPhone Case 8/7 brown,Cover with vintage design book store card slot front cover and support for iPhone,59.99,56.99,11865403
TWS0116,Twelve South BookBook Case Black iPhone 7/8,Cover with vintage design book store card slot front cover and support for iPhone 7/8,59.99,56.99,11865403
PRY0007,Prynt iPhone Case Black Portable Printer,Portable hard case with 10 sheets of printer includes print and connection Lightning iPhone app,74.99,74.99,11905404
PRY0008,Prynt White iPhone Case Portable Printer,Portable hard case with 10 sheets of printer includes print and connection Lightning iPhone app,74.99,74.99,11905404
PRY0009,Zink Prynt Sticker Pack 40 sheets Print,Pack of 40 sheets printing adhesive back for printer Prynt Case,19.99,17.99,11905404
SPE0193,Speck CandyShell Apple Watch Fit Series 1 38mm Transparent,rigid housing with compact design and double layer of protection for Apple Watch 38 mm,24.95,19.99,2434
SPE0194,Speck CandyShell Case Fit Apple Watch 42mm Transparent,rigid housing with compact design and double layer of protection for Apple Watch 42 mm,16.52,19.99,2434
SPE0196,Speck CandyShell Case Fit Apple Watch 42mm Black / Gray,rigid housing with compact design and double layer of protection for Apple Watch 42 mm,24.95,19.99,2434
BEL0303,"Belkin Suit Line Backpack for MacBook Pro 13 ""and 15"" / Retina / Air 13 ""Black",Lightweight backpack with durable material and 13 internal pockets for MacBook Pro 13-inch and 15-inch MacBook Pro Retina 15 / Air 13 inch Black,57.99,49.99,1392
HTE0001-A,Open - Hyper Pearl 3000mAh USB Battery mirror and Rosa,Mirror + USB 3000mAh Portable Battery (2.4A) refitted with cables for iPhone,34.95,23.91,1298
IFX0049-A,"Open - iFixit battery Macbook Pro 13 ""OEM (Mid 2009 / Mid 2010 / Early 2011 / Late 2011 / Mid 2012)",Reconditioned OEM battery for MacBook Pro 13,99.99,80.42,1298
WAC0191-A,Open - Wacom Bamboo Folio A4 Black,Bloc Notes Intelligent refitted with cover and case for tablets up 97 includes pencil precision,199.9,159.53,1298
APP2139-A,"Open - Apple iPad Pro 12.9 ""Wi-Fi 64GB Space Gray",Pro 12.9 inch iPad Apple 64GB Wi-Fi reconditioned,899.0,830.5,1298
WAC0236-A,Open - Education - A4 Wacom Bamboo Slate Gray,Smart Bloc notes A4 size reconditioned app includes pen button to save your notes,149.99,96.66,1298
APP1810-A,"Like new - Apple MacBook Pro 15 ""Core i7 Touch Bar 26GHz | RAM 16GB | 256GB PCIe SSD | 450 2GB Radeon Pro Space Gray",MacBook Pro 15-inch Touch Bar refitted with Core i7 to 26GHz with 16GB of RAM and 256GB PCIe SSD,2699.0,2275.59,1298
JBL0129,JBL Flip 4 Speaker Bluetooth Black,Portable Bluetooth Speaker submersible in water and JBL surround sound Connect + iPhone iPad iPod app,139.99,114.99,5398
JBL0130,JBL Flip 4 Speaker Bluetooth Red,Portable Bluetooth Speaker submersible in water and JBL surround sound Connect + iPhone iPad iPod app,139.99,114.99,5398
ICA0086,Incase Leather Strap Band Apple Watch 42mm Black,Nylon belt finish and adjustable buckle anodized aluminum Apple Watch 42 mm,59.95,42.99,2449
ICA0082,Incase Leather Strap Band Apple Watch 38mm Black,Genuine leather strap with stainless steel buckle Apple Watch 38 mm,59.95,46.99,2449
ICA0083,Incase Leather Strap Band Apple Watch 38mm brown,Genuine leather strap with stainless steel buckle Apple Watch 38 mm,59.95,46.99,2449
ICA0087,Incase Nylon Nato Strap 42mm Red Apple Watch,Nylon belt finish and adjustable buckle anodized aluminum Apple Watch 42 mm,39.95,30.99,2449
ICA0085,Incase Nylon Nato Strap 38mm Red Apple Watch,Nylon belt finish and adjustable buckle anodized aluminum Apple Watch 42 mm,39.95,30.99,2449
ICA0084,Incase Nylon Nato Strap Black 38mm Apple Watch,Nylon strap with adjustable finish anodized aluminum pin Apple Watch 38 mm,39.95,30.99,2449
POL0013,ZIP Polaroid Mobile Printer Bluetooth White,portable printer with Bluetooth and NFC Micro-USB charging port connection and print 10 sheets for iPhone iPad and iPod,159.0,139.99,11905404
POL0014,ZIP Polaroid Mobile Printer Bluetooth Black,portable printer with Bluetooth and NFC Micro-USB charging port connection and print 10 sheets for iPhone iPad and iPod,159.0,139.99,11905404
POL0015,Polaroid ZINK Printing Pack 30 Sheets,Pack of 30 print sheets resistant material and back adhesive for Polaroid ZIP,19.0,19.0,11905404
APP2062,"Apple iMac 215 ""Core i5 16GHz | 16GB RAM | 1TB HDD | Magic Trackpad 2",IMac desktop computer 215 inch HDD 1TB RAM 16GB with Magic Trackpad 2,1579.0,1305.59,"2,16E+11"
IFX0159,iFixit Electronics Kit Essential Tools iOS and Mac,Kit parts and repair or replacement tools for Mac iPhone iPad and iPod,24.99,23.74,14305406
OWC0227,OWC Mercury Helios PCIe Thunderbolt Box 3,Thunderbolt expansion box 3 for half-length PCIe Cards,392.97,289.99,11935397
DVI0007,"Devia Grace Light iPad Case Pro 105 ""Gold",Case rigid transparent front cover rear cover support for cases Pro 105 inches,35.0,16.99,12635403
DVI0008,"Devia Grace Light iPad Case Pro 105 ""Black",Case rigid transparent front cover rear cover support for cases Pro 105 inches,35.0,16.99,12635403
DVI0009,"Devia Grace Light iPad Case 105 Pro ""Rosa",Case rigid transparent front cover rear cover support for cases Pro 105 inches,35.0,16.99,12635403
SAN0180,Sandisk Extreme Memory Card microSDHC UHS-I 32GB V30 100MB / s-60MB / s,Micro memory card read speed 100MB / s and speed of video: U3 C10 and V30 (adapter included),25.99,23.28,57445397
SAN0181,Sandisk Extreme Memory Card v30 microSDXC 64GB UHS-I 100MB / s-60MB / s,MicroSDXC memory card 64GB UHS Class 3 v30 speeds 100MB / s - 60MB / s,49.99,43.28,57445397
SAN0182,Sandisk Extreme Memory Card 128GB v30 microSDXC UHS-I 100MB / s-90MB / s,Memory card read speed 100MB / s and speed of video: U3 C10 and V30,99.99,82.28,57445397
SAN0183,Sandisk Extreme Pro microSDHC Memory Card 32GB UHS-I 100MB / s 90MB / s,Micro memory card read speed 100MB / s and speed of video: U3 C10 and V30 (adapter included),32.99,28.28,57445397
SAN0184,Sandisk Extreme Pro Memory Card 64GB microSDXC UHS-I 100MB / s 90MB / s,Memory card 64GB microSDXC UHS-I U3 and speeds 100MB / s-90MB / s,56.99,49.28,57445397
JBL0131,JBL T200A PureBass Red Headphones,Lightweight design headphones with 3.5 mm jack connection JBL Sound quality sound and durable material for iPhone iPad and iPod,19.99,14.99,5384
WAC0194-A,Open - Wacom Bamboo Stylus Solo 4 White,with standard digital pen tip and triangular design for iPad and iPhone,19.9,11.3,1298
